Review,Product,Rating,Username,Date
"tipe kulitku kering tipe kulitku normal
dtgnya cepet, packagingnya man ko bublenya tebel, udh yg ke 4 kalinya jd karna emng dah nyaman aja make ini...ehehe",AZARINE TONER 90ml,bintang 5,f***h,1/16/2024
"Udah order berkali2 biasanya aman tp kali ini kurang barangnya, mau komplain tp lupa video unboxing :( semoga lain kali lebih teliti ya packingnya

Salah satu sunscreen lokal kesayangan, worth to buyðŸ‘ðŸ¼",[Twin Pack Gel] Azarine Hydrasoothe Sunscreen Gel SPF45 PA++++ 50ml,bintang 5,R***a,1/16/2024
agak kecewa sm pengemasannya. kardusnya peyok dalemnya gak ada bubble wrap biasanya ada bubble wrap nya. untung paketnya aman,AZARINE TONER 90ml,bintang 4,L***a,1/16/2024
agak kecewa sm pengemasannya. kardusnya peyok dalemnya gak ada bubble wrap biasanya ada bubble wrap nya. untung paketnya aman,Azarine Cicamide Barrier Sunscreen Moisturiser SPF35 PA+++ 40ml,bintang 4,L***a,1/16/2024
"ringan bgt, tipe tekstur moist yg kusuka, cocok bgt buat kulit super berminyakðŸ‘",Azarine Barrier Moisturizer Series Pelembab Wajah Cream Gel Moist 30g,bintang 5,N***a,1/16/2024
suka ingredientsnya. mudah2an cocok..terima kasih,[Azarine x Red Velvet] Make It Brow-cara! [7 ml],bintang 5,Budhi,1/16/2024
suka ingredientsnya. mudah2an cocok..terima kasih,[CLEARANCE SALE] Azarine CBD Ampoule Bubble Me Primer Makeup Hair Spa,bintang 5,Budhi,1/16/2024
tipe kulitku berminyak,[GEL] Azarine Hydrashoothe Sunscreen Gel SPF45++++ 50ml,bintang 5,N***a,1/16/2024
tipe kulitku berminyak tipe kulitku sensitif,Azarine Moisturizer Advanced Youth & Serum Retinol Complex [2 PCS],bintang 5,Widya,1/16/2024
tipe kulitku kering,[Twin Pack] Azarine Hydramax-C Sunscreen Serum SPF50 PA++++ 40ml,bintang 5,Bethari,1/16/2024
bagussssss,[GEL] Azarine Hydrashoothe Sunscreen Gel SPF45++++ 50ml,bintang 5,A***h,1/16/2024
