Review,Product,Rating,Username,Date
Bagus memuaskan,[Twin Pack Gel] Azarine Hydrasoothe Sunscreen Gel SPF45 PA++++ 50ml,bintang 5,R***n,1/25/2024
masalah kulitku jerawat masalah kulitku pori besar tipe kulitku kombinasi tipe kulitku sensitif,Azarine Calm My Acne Sunscreen Moisturiser SPF35 PA+++ 40ml,bintang 5,Y***a,1/25/2024
Mantul,Azarine Retinol Smooth Glowing Serum 20ml,bintang 5,Nurul,1/25/2024
pesanan sesuai,Azarine Hydramax-C Sunscreen Serum SPF 50 PA++++ 40 ml,bintang 5,anggarini,1/25/2024
No review found,[Twin Pack Gel] Azarine Hydrasoothe Sunscreen Gel SPF45 PA++++ 50ml,bintang 1,Lili,1/25/2024
"mkasih pesanan sudah sesuai pesanan saya,
pengiriman cepat matappppp....",Azarine Barrier Moisturizer Series Pelembab Wajah Cream Gel Moist 30g,bintang 5,Puji,1/25/2024
masalah kulitku jerawat masalah kulitku pori besar,AZARINE TONER 90ml,bintang 5,AISYAH,1/25/2024
"sesuai pesanan, pengiriman cepat dan pengemasan bagus sekalii. mantappp",[Azarine x Red Velvet] Tinted Lippie Cake Lip Tint 2.9ml,bintang 5,P***i,1/25/2024
tefima kasih pesenanya uxah sampai..sudah cocok pakai skincare dari merk azarine kualitas baguss harga juga terjangkou...,Azarine Moisturizer Advanced Youth & Serum Retinol Complex [2 PCS],bintang 5,e***h,1/25/2024
terima kasih pesenan nya udah sampai udah cocok pakai skincare dari merk azarine ringan d pakai nya bikin kulit tambah cerah dan lembut,Azarine Hydramax Water Bank Serum 20ml,bintang 5,e***h,1/25/2024
tipe kulitku berminyak,Azarine Hydramax-C Sunscreen Serum SPF 50 PA++++ 40 ml,bintang 5,Sahda,1/25/2024
Exp masih lama,[Twin Pack] Azarine Hydramax-C Sunscreen Serum SPF50 PA++++ 40ml,bintang 5,M***d,1/25/2024
Exp masih lama,[Twin Pack] Azarine Hydramax-C Sunscreen Serum SPF50 PA++++ 40ml,bintang 5,M***d,1/25/2024
Ini serum yang sangat saya suka dari azarine. Teksturnya cair namun agak kental sedikit dan sangat mudah diaplikasikan ke wajah dan salah satu serum yang bagus digunakan jika lagi bruntusan atau menggunakan make up tebal sekalipun karena tetap melembabkan kulit saya,Azarine Hydramax Water Bank Serum 20ml,bintang 5,Tina,1/25/2024
"Ini bener-bener produk azarine yg luar biasa dan tidak pernah membuat saya kecewa. Teksturnya seperti jel namun jika kita aplikasikan ke wajah, berubah menjadi bisa dan setelah dibilas dengan air, wajah saya yg sama sekali tidak dibersihkan dengan micelar water terasa bersih.",[TWIN PACK] Azarine Vitamin Lab Bubble on Me Deep Mask Cleanser 60ml,bintang 5,Tina,1/25/2024
Teksturnya seperti jel namun tidak lengket dan lumayan cepat meresap di  tipe kulitku kombinasi,[TWIN PACK] Azarine CBD Hydraoxidant Ampoule 40ml,bintang 5,Tina,1/25/2024
Ketiganya luar biasa menghidrasi kulit jika digabungkan dan tidak membuat wajah saya gatal.,Azarine 3 Pcs Paket Barrier Moisturizer Series with Sunscreen 30g,bintang 5,Tina,1/25/2024
"sukaa sama sunscreen ini krna dikasi tau temen, udh pembelian kedua sih inii",Azarine Calm My Acne Sunscreen Moisturiser SPF35 PA+++ 40ml,bintang 5,J***n,1/25/2024
"bau nya enakk, gak nyengat bgt. make nya kulit harus bner bner kering jkalo kena air jadinya agak licin trus lengket. tpi gkpapa sih gk bgitu kerasa. overall sukaa dan semoga cocok",Azarine Body Guard Moisturizer Sunscreen Serum 100ml,bintang 5,J***n,1/25/2024
Done ðŸ‘ðŸ»,[Twin Pack Gel] Azarine Hydrasoothe Sunscreen Gel SPF45 PA++++ 50ml,bintang 5,A***i,1/25/2024
tipe kulitku berminyak masalah kulitku jerawat masalah kulitku pori besar,Azarine Acne Gentle Cleansing Foam,bintang 5,M***n,1/25/2024
Bagus bgt cocok dikulit laki2 suka bgt lovependkdksnz,[Azarine x Red Velvet] Tinted Lippie Cake Lip Tint 2.9ml,bintang 5,L***s,1/25/2024
Baikkk,[GEL] Azarine Hydrashoothe Sunscreen Gel SPF45++++ 50ml,bintang 5,S***i,1/25/2024
tipe kulitku berminyak masalah kulitku pori besar,[GEL] Azarine Hydrashoothe Sunscreen Gel SPF45++++ 50ml,bintang 5,R***i,1/25/2024
"packaging aman, bubble wrap tebel dan dikardusin juga. pengiriman cepat.",Azarine Moisturizer Advanced Youth & Serum Retinol Complex [2 PCS],bintang 5,W***a,1/25/2024
"barang sesuai pesanan, expired aman",Azarine Revitalizing Anti Aging Serum 20ml,bintang 5,N***g,1/24/2024
"barang sesuai pesanan, expired aman",Azarine Pore Tightening & Oil Control Moist Serum 20 ml,bintang 5,N***g,1/24/2024
"ok sih, tapi kenapa yg satu ga ada segel nya ya ?",Azarine Body Guard Moisturizer Sunscreen Serum 100ml,bintang 4,Reiza,1/24/2024
"bahannya ringan, mantul",Azarine Cicamide Barrier Sunscreen Moisturiser SPF35 PA+++ 40ml,bintang 5,r***a,1/24/2024
tekstur lembut nyaman dikulit cocok banget daahhh,[Twin Pack Gel] Azarine Hydrasoothe Sunscreen Gel SPF45 PA++++ 50ml,bintang 5,irma,1/24/2024
warnanya agak beda sama di etalase jadinya cream agak pink tapi saya suka2 sj. buat nambah koleksi warna lain.,[Azarine x Red Velvet] Tinted Lippie Cake Lip Tint 2.9ml,bintang 5,Inge,1/24/2024
tipe kulitku berminyak,[Azarine x Marvel] Vitamin C 10% + Diamond Booster Serum 20ml,bintang 5,F***a,1/24/2024
tipe kulitku berminyak,Azarine Acne Spot Serum 20ml,bintang 5,F***a,1/24/2024
"beli twin. yg dikirim cuma 1. difollow up admin katanya mau dikirim diluar toped kekuranganya. maximal 6 hari kerja. ini sudah lebih dari 6 hari kerja. kemudia saya tanya cuma dijawab. PASTI DIKIRIM KOK KAK. really bad attitude !

review saya edit. kekurangan telah dikirim seller. terimakasih azarine masih amanah. next qc nya diperketat . shingga saya konsumen ga perlu repot2 lagi video unboxing krn sudah percaya pada azarine.",[Twin Pack Gel] Azarine Hydrasoothe Sunscreen Gel SPF45 PA++++ 50ml,bintang 4,michael,1/24/2024
parah bangetttt harganyaa.. eeeh besoknya malah turun lg.. pan gemesss... tp lanjut beli lg.. sayaaang klo dilewatin,Azarine Moisturizer Advanced Youth & Serum Retinol Complex [2 PCS],bintang 5,D***h,1/24/2024
"parah banget flash sale nyaa... 

cucok lah ama azarine..",[CLEARANCE SALE] Azarine Twin Pack Sunscreen Mist Micellar Serum 2pcs,bintang 5,D***h,1/24/2024
tipe kulitku berminyak,Azarine Oil Free Brightening Daily Moisturizer,bintang 5,I***e,1/24/2024
"penjual amanah.. barang kurang ... dikirim ulang... mksh yaðŸ‘ƒðŸ™
moga berkah . dagangannya laku",[Twin Pack Gel] Azarine Hydrasoothe Sunscreen Gel SPF45 PA++++ 50ml,bintang 5,Lukmayanti,1/24/2024
"paketnya sudah sampai dengan aman, baru pertama kali pakai nih smg cocok sama kulit wajahku.",Azarine Cicamide Barrier Sunscreen Moisturiser SPF35 PA+++ 40ml,bintang 5,A***a,1/24/2024
"Harga lebih murah ditokped ketimbang di keranjang oranye,sejauh ini si belum bikin putih putih banget tp entah kenapa masih cinta produk azarine,Smg pemakaian rutin bikin benar2 wajah putih dan glowing kaya klaimnya",Azarine Ultralight Hydraglow Day Cream SPF 30 PA+++ C White 25gr,bintang 5,M***a,1/24/2024
"Sebenarnya g terlalu suka produk eyebrownya karena isi sedikit bgt dan gampang patah,tapi hasilnya bagus,tolong diperbaiki kekurangan itu azarine ,kl produk yg lain bagus dan suka",[Azarine x Red Velvet] Oh! MY BROW DEFINER 0.06gr,bintang 3,M***a,1/24/2024
"bagus dan suka ,lebih murah ditoko ini ketimbang di keranjang oranye",Azarine Brightening Facial Cleanser 60 Ml,bintang 5,M***a,1/24/2024
sesuai pesanan. pengemasan dan pengiriman oke. makasih,[Azarine x Red Velvet] Tinted Lippie Cake Lip Tint 2.9ml,bintang 5,S***i,1/24/2024
baru nyoba semoga cocok,Azarine Barrier Moisturizer Series Pelembab Wajah Cream Gel Moist 30g,bintang 5,F***y,1/24/2024
baru nyoba semoga cocok,Azarine AHA-BHA-PHA Peeling Serum 20ml,bintang 5,F***y,1/24/2024
"Bagus sekali sesuai pesanan sudah order yang keberapa kali, karna sebagus itu dan cocok untuk oily skin.",[GEL] Azarine Hydrashoothe Sunscreen Gel SPF45++++ 50ml,bintang 5,Fanny,1/24/2024
tipe kulitku berminyak masalah kulitku jerawat,Azarine Acne Gentle Cleansing Foam,bintang 5,s***i,1/24/2024
tipe kulitku berminyak masalah kulitku jerawat,Azarine Calm My Acne Sunscreen Moisturiser SPF35 PA+++ 40ml,bintang 5,novian,1/24/2024
wkwkw mleyot,Azarine Pore Tightening & Oil Control Moist Serum 20 ml,bintang 3,Intan,1/24/2024
so far ini produk paling nyaman buat kulit wajah & pasti beli lagii â¤ï¸â¤ï¸â¤ï¸â¤ï¸â¤ï¸,Azarine 3 Pcs Paket Barrier Moisturizer Series with Sunscreen 30g,bintang 5,D***y,1/24/2024
"pengiriman capet, warnanya cakep, rada wangi",[Azarine x Red Velvet] Tinted Lippie Cake Lip Tint 2.9ml,bintang 5,Widya,1/24/2024
Pengemasannya terlalu lama. gak gercep,Azarine Calm My Acne Sunscreen Moisturiser SPF35 PA+++ 40ml,bintang 3,Linda,1/24/2024
"tipe kulitku kombinasi 
best combination sama moisturizer yg ijo",Azarine Acne Gentle Cleansing Foam,bintang 5,T***s,1/24/2024
tipe kulitku berminyak,Azarine Moisturizer Advanced Youth & Serum Retinol Complex [2 PCS],bintang 5,M***i,1/23/2024
baru akan coba moga cocok,Azarine Barrier Moisturizer Series Pelembab Wajah Cream Gel Moist 30g,bintang 5,a***n,1/23/2024
"baru akan dicoba, moga sesuai deskripsi",Azarine Cicamide Barrier Sunscreen Moisturiser SPF35 PA+++ 40ml,bintang 5,a***n,1/23/2024
Pengemasan cepat dan aman,Azarine Cicamide Barrier Sunscreen Moisturiser SPF35 PA+++ 40ml,bintang 5,dezy,1/23/2024
Pengemasan cepat dan aman,[Twin Pack] Azarine Barrier Moisturizer Series Pelembab Wajah [2x30g],bintang 5,dezy,1/23/2024
"baru akan coba, moga cocok",Azarine Brightening Facial Cleanser 60 Ml,bintang 5,a***n,1/23/2024
"nympe nya cepett,,  ringan banget di kulit",Azarine Calm My Acne Sunscreen Moisturiser SPF35 PA+++ 40ml,bintang 5,T***a,1/23/2024
warna lip tint nya saya suka. terimakasih banyak :â -â ),[TWINPACK] Azarine Calm My Acne Sunscreen Moisturiser SPF35 PA+++ 40ml,bintang 5,Widia,1/23/2024
good,[Azarine x Red Velvet] Perfect Ombre Lips Kit,bintang 5,T***a,1/23/2024
"Tipe kulitku combi to oily, serumnya cocok gampang nyerap dan lumayan ngaruh",Azarine AHA-BHA-PHA Peeling Serum 20ml,bintang 4,i***a,1/23/2024
tipe kulitku kombinasi,[GEL] Azarine Hydrashoothe Sunscreen Gel SPF45++++ 50ml,bintang 5,Jamiah,1/23/2024
"udah jadi sunscreen andalan, cocok buat kulit mukaku yg kering, barang sampai dg aman",Azarine Hydramax-C Sunscreen Serum SPF 50 PA++++ 40 ml,bintang 5,c***a,1/23/2024
tipe kulitku berminyak masalah kulitku pori besar,Azarine Barrier Moisturizer Series Pelembab Wajah Cream Gel Moist 30g,bintang 5,Y***A,1/23/2024
"worth to buy, 2 items dpt di harga 59kðŸ˜ packingnya niat dan aman bgt. thank u somuch azarine&tokped!ðŸ˜­ðŸ«µðŸ»ðŸ’— tapi plis non aktifin ekspedisi sicepat, bukannya cepet malah lambat nyampenyaðŸ˜  masa sda-sub sampe 3hariðŸ˜ ðŸ«µðŸ» azarine ngirim pake sapx aja sehari sampe loh, itu mah bukan ekspedisi sicepat tapi silambatðŸ˜ ðŸ˜ ðŸ˜ ",Azarine Moisturizer Advanced Youth & Serum Retinol Complex [2 PCS],bintang 5,Gilang,1/23/2024
"Barang sampai dengan baik, sedikit masalah dalam pengiriman.",Azarine Cicamide Barrier Sunscreen Moisturiser SPF35 PA+++ 40ml,bintang 5,D***a,1/23/2024
Bagus dan original pengiriman nya juga cepet banget,Azarine Hair Spa Aloevera 200 gr,bintang 5,Aan,1/23/2024
ok banget ðŸ‘ðŸ‘,[TWINPACK] Azarine Cicamide Barrier Sunscreen Moisturiser SPF35 PA+++,bintang 5,s***i,1/23/2024
"Barang sesuai deskripsi. Kemasan dan packing aman dan rapi.
Semoga khasiatnya cocok.
Recommended ðŸ‘",Azarine Revitalizing Anti Aging Serum 20ml,bintang 5,Masjhar,1/23/2024
"Barang sesuai deskripsi, kemasan dan packing aman dan rapi.
Tentang khasiat semoga cocok.
Recommended ðŸ‘",Azarine Active Bright - Brightening Day Moisturiser SPF 25++ 20gr,bintang 5,Masjhar,1/23/2024
belum dicoba semoga cocok,Azarine Acne Spot Serum 20ml,bintang 5,Armelita,1/23/2024
No review found,Azarine Calm My Acne Sunscreen Moisturiser SPF35 PA+++ 40ml,bintang 5,Armelita,1/23/2024
tipe kulitku kombinasi masalah kulitku jerawat,Azarine Calm My Acne Sunscreen Moisturiser SPF35 PA+++ 40ml,bintang 5,a***a,1/23/2024
pengiriman cepat. barang sesuai,Azarine Healthy Glow Skin Kit,bintang 5,F***h,1/23/2024
masalah kulitku jerawat,Azarine Calm My Acne Sunscreen Moisturiser SPF35 PA+++ 40ml,bintang 5,Yuliana,1/23/2024
Belum coba yg varian ini mudah2an cocok,Azarine Retinol Smooth Glowing Serum 20ml,bintang 5,Frisco,1/23/2024
Selalu cocok di wajah,[TRIPLEPACK] Azarine Cicamide Barrier Sunscreen Moisturiser SPF35 PA++,bintang 5,M***d,1/23/2024
"wanginyaa sukak padahal blind buy, semoga cocokk",Azarine Body Guard Moisturizer Sunscreen Serum 100ml,bintang 5,a***s,1/23/2024
"tipe kulitku kering, pakai sunscreen ini lebih lembab, bagus produknya. terimakasih semoga bermanfaat ya",[GEL] Azarine Hydrashoothe Sunscreen Gel SPF45++++ 50ml,bintang 5,TRIO,1/23/2024
tipe kulitku berminyak,Azarine Calm My Acne Sunscreen Moisturiser SPF35 PA+++ 40ml,bintang 5,R***a,1/23/2024
tipe kulitku normal,Azarine Barrier Moisturizer Series Pelembab Wajah Cream Gel Moist 30g,bintang 5,TriyaFiryal,1/23/2024
"Kalau urusan sunscreen, produk ini adalah favorit. ðŸ‘ðŸ»",[Twin Pack Gel] Azarine Hydrasoothe Sunscreen Gel SPF45 PA++++ 50ml,bintang 5,R***o,1/23/2024
thank u min ss tiba dengan aman,[Twin Pack] Azarine Hydramax-C Sunscreen Serum SPF50 PA++++ 40ml,bintang 5,u***i,1/23/2024
tipe kulitku kering,[TWINPACK] Azarine Cicamide Barrier Sunscreen Moisturiser SPF35 PA+++,bintang 5,R***a,1/23/2024
Ternyata wanginya ga seperti yg diharapkan. Tp efeknya di kulit tetep bagus.,Azarine Body Guard Moisturizer Sunscreen Serum 100ml,bintang 4,Sabina,1/23/2024
"Lumayan dapet diskon. Tapi pengirimannya lamaðŸ¥¹
Belum bisa review, baru pembelian pertama",Azarine Niacinamide 5% + Moisture Sepiwhite Serum 20ml,bintang 5,Intan,1/23/2024
belum coba. beli karena disaranin. semoga cocok. packingnya juga aman. pengirimannya lumayaan tipe kulitku kombinasi,Azarine Retinol Smooth Glowing Serum 20ml,bintang 4,Chintya,1/23/2024
abguusss,Azarine Retinol Smooth Glowing Serum 20ml,bintang 5,DWI,1/23/2024
"sunscreen enak mudah menyerap krn texture gel, cuman disayangkan krn lubang tubenya gede jadi kalo pakai dosis 2 jari gendut tuh radak susah, mungkin bisa diperbaiki dari segi packaging  tipe kulitku kombinasi",[Twin Pack] Azarine Hydramax-C Sunscreen Serum SPF50 PA++++ 40ml,bintang 4,I***e,1/23/2024
tipe kulitku normal tipe kulitku berminyak masalah kulitku jerawat tipe kulitku kombinasi,[TWINPACK] Azarine Calm My Acne Sunscreen Moisturiser SPF35 PA+++ 40ml,bintang 5,Mainan,1/23/2024
tipe kulitku berminyak,Azarine Cicamide Barrier Sunscreen Moisturiser SPF35 PA+++ 40ml,bintang 5,R***a,1/23/2024
sudah sering beli dan belum ada yg tidak sesuai dengan produknya,Azarine Hydramax-C Sunscreen Serum SPF 50 PA++++ 40 ml,bintang 5,Yeska,1/23/2024
"tipe kulitku kombinasi masalah kulitku kerutan masalah kulitku pori besar
bagus banget muka ku jadi lebih haluss",Azarine AHA-BHA-PHA Peeling Serum 20ml,bintang 5,N***o,1/23/2024
barang sudah sampai dengan selamat. tks,[Twin Pack] Azarine Hydramax-C Sunscreen Serum SPF50 PA++++ 40ml,bintang 5,Gunar,1/23/2024
Cocok untuk kulit kering,Azarine Niacinamide 10%+Dipotassium Glycyrrhizate Glorious Serum 20ml,bintang 5,F***x,1/23/2024
"tipe kulitku kering mayan bantu sii, btw tutupnya yg dalem susah banget di bukaðŸ˜­",Azarine Barrier Moisturizer Series Pelembab Wajah Cream Gel Moist 30g,bintang 5,a***u,1/23/2024
tipe kulitku kombinasi,Azarine Moisturizer Advanced Youth & Serum Retinol Complex [2 PCS],bintang 5,o***v,1/23/2024
"Setelah menggunakan 2 produk ini selama beberapa hari, kulit wajah yang tadinya kering sekarang terasa lembab ðŸ«°ðŸ» love it!",Azarine Skin Power Combo Paket Mencerahkan & Menghaluskan [2 x 20 ml],bintang 5,Veby,1/23/2024
tipe kulitku berminyak masalah kulitku jerawat,[GEL] Azarine Hydrashoothe Sunscreen Gel SPF45++++ 50ml,bintang 5,N***g,1/23/2024
2 minggu baru sampe,[GEL] Azarine Hydrashoothe Sunscreen Gel SPF45++++ 50ml,bintang 1,V***a,1/23/2024
"cocok di kulit yg sensitif, teksturnya ga lengket",Azarine Calm My Acne Sunscreen Moisturiser SPF35 PA+++ 40ml,bintang 5,Nancy,1/23/2024
tipe kulitku berminyak,[Combo Protection] Azarine Sunscreen Gel + Body Guard Sunscreen Serum,bintang 5,dani,1/23/2024
tipe kulitku berminyak,Azarine Oil Free Brightening Daily Moisturizer,bintang 5,dani,1/23/2024
pengiriman lama dari sebelum tahun baru dan paket tidak saya terima. ekspedisi nyasar kirim paket nya.,Azarine Hydramax-C Sunscreen Serum SPF 50 PA++++ 40 ml,bintang 1,S***a,1/23/2024
Cantik warnanya dan ternyata pigmented bgt ya,[Azarine x Red Velvet] Sweet Treats Eyeshadow [5.5 gr],bintang 5,A***a,1/23/2024
"Cocok, udah sering pake. OK.",[Twin Pack Gel] Azarine Hydrasoothe Sunscreen Gel SPF45 PA++++ 50ml,bintang 5,N***a,1/23/2024
udah sering repeat order. ok,Azarine Oil Free Brightening Daily Moisturizer,bintang 5,N***a,1/23/2024
tipe kulitku berminyak,Azarine Barrier Moisturizer Series Pelembab Wajah Cream Gel Moist 30g,bintang 5,R***a,1/23/2024
Aku masih belum pernah coba tapi semoga nanti sesuai expetasii. Barangnya sampe dengan aman plus bubble wrapnya tebel bangettttt.,Azarine Cicamide Barrier Sunscreen Moisturiser SPF35 PA+++ 40ml,bintang 5,Elsa,1/23/2024
"packingnya niat bgt padahal cuma beli lip cream, so aman bgt nyampe ke custðŸ˜­ðŸ’— warnanya cantik buat ombreðŸ˜ thx u tokped&azarine!ðŸ’—",[Azarine x Red Velvet] Simply Chic Lips Kit Velvety Lippie Cream 2pcs,bintang 5,Gilang,1/23/2024
No review found,Azarine AHA-BHA-PHA Peeling Serum 20ml,bintang 5,Zaki,1/23/2024
barang dikirim cuma 1 padahal beli twin wkwkwk. halo azarine kalo mau aku ubah ratingnya tolong kirim barang kurangnya yg harusnya jadi hak saya ya!!,[Twin Pack Gel] Azarine Hydrasoothe Sunscreen Gel SPF45 PA++++ 50ml,bintang 1,Jovita,1/23/2024
"lucuuu bgt warnanya hihi, liat punya temen bagus jadi aku ikut beli >_<",[Azarine x Red Velvet] Tinted Lippie Cake Lip Tint 2.9ml,bintang 5,E***i,1/23/2024
sudah tube ke 3 ðŸ«¶ðŸ»ðŸ«¶ðŸ» bagus bgt cocok buatku,Azarine Calm My Acne Sunscreen Moisturiser SPF35 PA+++ 40ml,bintang 5,E***i,1/23/2024
"tipe kulitku kombinasi, masalah kulitku pori besar",Azarine Pore Tightening & Oil Control Moist Serum 20 ml,bintang 5,R***a,1/23/2024
mantap sesuk order neh âœŒï¸,Azarine Barrier Moisturizer Series Pelembab Wajah Cream Gel Moist 30g,bintang 5,R***a,1/23/2024
"warnanya cantikkk, suka â¤ï¸â¤ï¸â¤ï¸",[Azarine x Red Velvet] Tinted Lippie Cake Lip Tint 2.9ml,bintang 5,nabilah,1/23/2024
"buat akuu, ini enak banget ss nya, nggak lengket, finish nya enak banget di kulitku yg oilyy. sukaaaâ¤ï¸â¤ï¸",Azarine Calm My Acne Sunscreen Moisturiser SPF35 PA+++ 40ml,bintang 5,nabilah,1/23/2024
"ini cocok buat kulit sensitif oily acne prone kaya akuuuu, nggak perih, dan nggak bikin keringgg sukakkâ¤ï¸â¤ï¸",Azarine Micellar Water 90 ml,bintang 5,nabilah,1/23/2024
warnanya nude bangettt. beda sama di foto.,[Azarine x Red Velvet] Tinted Lippie Cake Lip Tint 2.9ml,bintang 2,Siska,1/23/2024
exp lama packsging rapi cpet bgt sampe sukses trus ajarin,Azarine Moisturizer Advanced Youth & Serum Retinol Complex [2 PCS],bintang 5,Ivan,1/23/2024
tipe kulitku berminyak tipe kulitku kering,Azarine Sunscreen Gel SPF45 PA++++ & Vitamin C 10% / Niacinamide 10%,bintang 5,M***a,1/23/2024
"Lotion nya bagus banget,teksturnya light watery gitu terus easy di apply ke kulit, nyerap nya cepet dan melembapkan banget gitu oya ini juga spf 50 juga lagi beneran bakal repurchase sih kalo abis hihi",[EXCLUSIVE DEALS] Azarine Body Guard Sunscreen Sunproof Sun O'clock,bintang 5,Aulia,1/23/2024
"Barang sesuai pesanan, barang bagus",Azarine Hydramax-C Sunscreen Serum SPF 50 PA++++ 40 ml,bintang 5,M***a,1/23/2024
Barangnya sesuai pesanan,Azarine Hydramax-C Sunscreen Serum SPF 50 PA++++ 40 ml,bintang 5,M***a,1/23/2024
nice,Azarine Acne Gentle Cleansing Foam,bintang 5,K***h,1/23/2024
tipe kulitku kering,AZARINE TONER 90ml,bintang 5,F***h,1/23/2024
"Baru mau coba pertama kali, semoga cocok.Next order lagi",Azarine 2 Pcs Paket Barrier Moisturizer Series with Serum 30g,bintang 5,A***f,1/23/2024
"tipe kulitku kering,  cocok, ringan dipakai, no white cast, cepat meresap, tidak bikin muka kilang"" minyak",Azarine Cicamide Barrier Sunscreen Moisturiser SPF35 PA+++ 40ml,bintang 5,A***y,1/23/2024
sunscreen favorit akuh. repurchase berkali2 tipe kulitku normal,[GEL] Azarine Hydrashoothe Sunscreen Gel SPF45++++ 50ml,bintang 5,vitria,1/23/2024
tipe kulitku kering,Azarine Cicamide Barrier Sunscreen Moisturiser SPF35 PA+++ 40ml,bintang 5,salsa,1/23/2024
tipe kulitku kombinasi,Azarine Retinol Smooth Glowing Serum 20ml,bintang 5,G***d,1/23/2024
"Cocok banget di kulitku yg oily, seenak itu",Azarine Oil Free Brightening Daily Moisturizer,bintang 5,A***i,1/23/2024
tipe kulitku berminyak,Azarine Hydramax-C Sunscreen Serum SPF 50 PA++++ 40 ml,bintang 5,Renny,1/23/2024
mudah2an cocok,Azarine AHA-BHA-PHA Peeling Serum 20ml,bintang 5,munjiah,1/23/2024
Pengiriman lama,[Twin Pack] Azarine Hydramax-C Sunscreen Serum SPF50 PA++++ 40ml,bintang 4,M***a,1/23/2024
exp panjang. Thx,[TWINPACK] Azarine Calm My Acne Sunscreen Moisturiser SPF35 PA+++ 40ml,bintang 5,Cindy,1/23/2024
cocok di aku gess tipe kulitku berminyak,[GEL] Azarine Hydrashoothe Sunscreen Gel SPF45++++ 50ml,bintang 5,C***a,1/23/2024
Baguss,[Twin Pack] Azarine Hydramax-C Sunscreen Serum SPF50 PA++++ 40ml,bintang 5,B***a,1/23/2024
"diterima dalam kondisi baik
semoga cocok",[GEL] Azarine Hydrashoothe Sunscreen Gel SPF45++++ 50ml,bintang 5,Alvina,1/23/2024
"barang original dan pengiriman cepat, semoga cocok karena baru pertama kali coba",Azarine Pore & Oily Skin Treatment Series (3x20ml),bintang 5,D***n,1/23/2024
"barang aman, pemakaian pertama kali semoga cocok",Azarine Calming Skin Pair Serum 20ml,bintang 5,W***a,1/23/2024
No review found,Azarine Cicamide Barrier Sunscreen Moisturiser SPF35 PA+++ 40ml,bintang 5,W***a,1/23/2024
"pemakaian pertama kali oke, semoga cocok biar gk gonta ganti lagi :')",Azarine AHA-BHA-PHA Peeling Serum 20ml,bintang 5,W***a,1/23/2024
"sudah repeat order yg kesekian kali nya, dapet potongan harga + diakon sampe 30 rb jadi berasa bayar 2 produk hehe + cashback 10 rb, sering2 pantengin promo & flash sale aja, thanks good luck",Azarine Cicamide Barrier Sunscreen Moisturiser SPF35 PA+++ 40ml,bintang 5,Arry,1/23/2024
"tipe kulitku kering, berjerawat, dan jerawatan",Azarine Calm My Acne Sunscreen Moisturiser SPF35 PA+++ 40ml,bintang 4,D***a,1/23/2024
"produknya oke, ga usah ditanya lah ya kualitasnya. tp pengiriman cenderung lama, bs jd krn sy order akhir tahun ya jd kepotong banyak libur",[Twin Pack Gel] Azarine Hydrasoothe Sunscreen Gel SPF45 PA++++ 50ml,bintang 5,F***a,1/23/2024
bahannya ringan langsung nyerap ke kulit..teksturnya agak kental tpi g yg berat gt...,AZARINE TONER 90ml,bintang 5,Puthri,1/23/2024
"gampang terserap
ringan
no whitecast",Azarine Hydramax-C Sunscreen Serum SPF 50 PA++++ 40 ml,bintang 5,A***i,1/23/2024
tipe kulitku berminyak tipe kulitku sensitif masalah kulitku jerawat,[TWINPACK] Azarine Calm My Acne Sunscreen Moisturiser SPF35 PA+++ 40ml,bintang 5,gita,1/23/2024
sun screen azarine mah terbukti juara buat kulit berminyak.,Azarine Bright Protection Kit,bintang 5,I***a,1/23/2024
suka banget sama liptint azarine yg warna ini karna bikin muka jadi keliatan fresh dan liptintnya wangi. isinya juga banyakkk,[Azarine x Red Velvet] Tinted Lippie Cake Lip Tint 2.9ml,bintang 5,Rafika,1/23/2024
baru mau coba sunscreen ini semoga cocokk. pengirimannya cepat dan aman,Azarine Calm My Acne Sunscreen Moisturiser SPF35 PA+++ 40ml,bintang 5,Rafika,1/23/2024
"kenapa ya ga baca pesanan saya ,saya pesen dua kok dateng satu",[Twin Pack Gel] Azarine Hydrasoothe Sunscreen Gel SPF45 PA++++ 50ml,bintang 1,Nasywa,1/23/2024
tipe kulitku kombinasi,[GEL] Azarine Hydrashoothe Sunscreen Gel SPF45++++ 50ml,bintang 4,Kharisma,1/23/2024
"Packing tebal aman, pengiriman cepat, produk lebih murah dari di toko offline
So far pake micellar ini sangat ringan
Cocok utk kulit sensitif
Meski utk mengangkat kotoran hrs dilakukan berulang tp gpp namanya jg murah xixi",Azarine Micellar Water 90 ml,bintang 5,T***s,1/23/2024
"tipe kulitku kombinasi tipe kulitku sensitif masalah kulitku kerutan masalah kulitku pori besar
semoga cocok.. krna pake produk azarine yg lain cocok2 aja sih..",Azarine Pore Tightening & Oil Control Moist Serum 20 ml,bintang 5,tri,1/23/2024
"tipe kulitku kombinasi tipe kulitku sensitif
pake ini kulit brasa lebih bersih aja.. komedo jga jdi gk gtu kliatan.. enakan deh.. cocok selalu pake produk azarine.. cuma aku gak tau yg bikin komedo ini sunscreennya atau bukan ya",Azarine AHA-BHA-PHA Peeling Serum 20ml,bintang 5,tri,1/23/2024
Good,[TRIPLEPACK] Azarine Calm My Acne Sunscreen Moisturiser SPF35 PA+++ 40,bintang 5,G***h,1/23/2024
Good,[Twin Pack Gel] Azarine Hydrasoothe Sunscreen Gel SPF45 PA++++ 50ml,bintang 5,G***h,1/23/2024
Good,Azarine Oil Free Brightening Daily Moisturizer,bintang 5,G***h,1/23/2024
"Barangnya sampai dengan selamat dan sesuai. Packagingnya Free bubble. Akhirnya menemukan SS yg sesuai sama kulitku. Karena kulitku itu, mudah berjerawat, sensitif, kering gampang dermatitis juga jadi bingung mau pilih Physical  atau Chemical SS.  Apalagi akhir-akhir ini pakai 4 salep setiap harinya. SALEP KERAS dari dr. Jadi, gimana ngga makin trust issue apalagi desas desus Chemical SS kurang di anjurkan untuk pemilik kulit sensitif. Modal niat dan review FD apk akhirnya aku CO. Akhirnya COCOK !!! ngga iritasi, komedoan ataupun nambah jerawat. Dia benar-benar bagus buat sensitive dry skin, berasa lembap nya. Bakal nyetok sih apalagi kalau di TokPed banyak diskon. Semoga Konsisten terus buat Azarine, Terimakasih â¤ï¸ðŸ¥°ðŸ™ðŸ»",Azarine Hydramax-C Sunscreen Serum SPF 50 PA++++ 40 ml,bintang 5,E***a,1/23/2024
tipe kulitku normal,Azarine Hydramax-C Sunscreen Serum SPF 50 PA++++ 40 ml,bintang 5,L***h,1/23/2024
No review found,Azarine Brightening C-Glow Serum 20ml,bintang 5,Tzaskiyatu,1/23/2024
tipe kulitku kombinasi,Azarine 2 Pcs Paket Barrier Moisturizer Series with Serum 30g,bintang 5,o***v,1/23/2024
Terima kasih,[TWINPACK] Azarine Calm My Acne Sunscreen Moisturiser SPF35 PA+++ 40ml,bintang 5,Lusiana,1/23/2024
