,Review
452,"mohon maaf, ini baru pertama kali ngasih penilaian gini. karena overall selama ini belanja di somethinc selalu puas. cuman kali ini paketan bolong dan kyk bener2 dibolongin ampe buble wrap-nya di dalam. ada 2 item yg hilang. salah satunya ini. kemungkinan krna kurirnya ga bertanggung jawab."
453,"beli nya memang pas diskon tp dikemasan expired masih lama, karena waterproof berniat mau coba dan liat ulasan jg lumayan bagus, tp pas coba sendiri ini seperti lem, kelopak mata lengket2 dan luntur padahal kerja di ruang ac, sy kira dijalan kali tadi keringetan eh coba hari kedua ketiga kali jg sama cuma tahan 2-3 jam udah luntur & nyiplak ke atas karna lengket2 terus serasa mau buka mata itu susah, buat yg ngantuk cocok sih buat ganjel tp sy now & gak pake lagi"
454,ini jg kurang cocok tp ini jg tergantung sm tipe kulit
455,ini jg ga cocok di aku padahal udah berharap sm produk ini
456,hmm katanya dpt gratisan nya pas beli dtgnya cuma 1 barang tok.. beli pas 11.11 kmrn pdhl ð
457,"revieuw jujur. tutupnya ga kenceng hampir setengahnya bocor. mohon diperhatikan ya, krn sayang banget bubble wrap ya udh tebel tp nutupnya ga kenceng"
458,"pengiriman lumayan lama.. dan gak dapat free 2 serum.. padahal di tulis free 2 serum anti aging
. untuk packing nya bagus. semoga cocok"
459,"lengket di kulit, di saya malah tambah jerawat. konsul dengan somethinc akhirnya saya berhenti pake yang ini, terus cuman pake yang resurrect multibiome serum. terlampir foto sebelum/sesudah (malah nambah + makin merah). mungkin saja cocok di orang lain tapi ga di saya."
460,"monmaap nih ya, kok bisa didalem plastik segel ada jmbut nyað­
takut muka malah jadi hitam metalikð­"
461,"bau serum nya agak unpleasant, awalnya aku kira memang bau nya seperti itu. tapi setelah tanya ke admin ig, kayaknya pas sampai ternyata produk nya rusak gabisa dipakai. ð¤¢ð please qc ur product before sending"
462,"kurang cocok ternyata buat kulit sensitif kayak aku,baru pake 1kali pas malem,paginya langsung bruntusan dan merah2"
463,"3 hari pemakaian malam aja, tapi muka merah bgt dan iritasi. tdk cocok sepertinya."
464,pas sampai barang rusak
465,slow respon dan proses pengiriman yang cukup lama dari saat pembayaran sudah terkonfirmasi. untuk produknya sendiri bagus sich. harap ke depannya lebih ditingkatkan lagi. thank you.
466,slow respon dan proses pengiriman yang cukup lama dari saat pembayaran sudah terkonfirmasi. untuk produknya sendiri bagus sich. harap ke depannya lebih ditingkatkan lagi. thank you.
467,pengiriman lama
468,slow respon dan proses pengiriman yang cukup lama dari saat pembayaran sudah terkonfirmasi. untuk produknya sendiri bagus sich. harap ke depannya lebih ditingkatkan lagi. thank you.
469,"eyeliner nya tutupnya gak bisa di tutup :( padahal warna nya bagus, tapi pas dibuka gak bisa ditutup, saya paksa nutup malah beleber jadi aku terpaksa tutup pake lem biar gak kering :( udah chat admin tapi blom di bales lagi"
470,"sunscreen gadungan ini. samasekali gak ampuh buat yang kena paparan sinar matahari yang lama (>30 menit). kalau kamu ciwi-ciwi unyu yang bawa mobil anti kena matahari / yang gak kuat kena sinar matahari lebih dari 1 menit, mungkin kamu cocok-cocok aja. tapi kalau kamu driver pejuang yang harus mengemudi di bawah matahari yang lama, ini samasekali gak cocok. padahal aku pakai dan reapply tiap jam (dan lama-lama akhirnya reapply tiap 15 menit sekali) tapi ujung-ujungnya kulitku tetep sunburned parah.

mau bebas alkohol kek, encapsulated uv filter kek, hybrid sunscreen kek, semua itu gak ngaruh!!!"
471,"tidak dapat bonus sunscreen, padahal masih ada promo di iklannya. dipersulit dgn hrus klik tombol bonus sehingga tidak tahu sudah dapat atau tidak bonusnya. next lebih baik lagi"
472,ada masalah pengiriman
473,kok gak dapat free nya yað¢ mbak2nya lupa ngasih atau apa gerangan ya? biasanya kalau beli ada free nya apa gitu pasti ada lhoð¤
474,barangnya baru mau dipakai.. baru ketahuan.. ternyata isinya yg 5% bukan 10%... gak sesuai deskripsi.. kesel bgt
475,prosesnya lama. pdhl beli bukan harga promo.
476,barang ok tapi pengiriman nya lama banget melebihi estimasi
477,"baru sadar kalau ga dapet kuas masker, padahal yg lain dpt kuas masker. ð­ð­ saya jg beli ny dgn harga normal dan beli di toko resmi disini"
478,"product nya udah pasti bagus, pengemasan lama sekali kayak order dari luar negeri padahal product lokal
saya pesen tanggal 25 okt baru sampe 2 november padahal official store"
479,"pengiriman lama bgt, 2 hari kemudian baru dikirim. kalo emg gitu cara kerjanya ya dideskripsikan lah di kolom deskripsi produk, jd transparan aja ke konsumen, utk bisa saling mengerti"
480,pengiriman sangat lama. tdk sesuai estimasi
481,pengiriman melebihi jangka waktu
482,"tidak ngefek untuk jerawat, malah makin parah :("
483,ga cocok dan yg oil ny bau banget2.. tolong lah d pikirkan kembali entah di kasi bau2 jeruk kek gtu... jgn kaya bau apek
484,maap ga kepake bruntusan
485,wajah makin keluar flek dan noda hitam â¹
486,baru unboxing eh malah bakuchiolnya tumoah banyak banget sampe nyerap ke bungkusnya dong. lain kali oackingnya harus diupgrade lagi ya min biar kejadian merugikan ini gak terulang lagiðð
487,brownya kok gak ada? tulisannya paket sama brow
488,"barang bagus, bagus banget malah. packing bagus pake bubblewarp. yang bikin males adalah kurirnya, tolong kasih opsi kurir lain selain jne, i really hate jne so bad! "
489,"cushion dipake 4 jam, crack di daerah hidung, bibir"
490,lama bgt sampenya
491,"tutup kemasan longgar seperti sdh dibuka krn ga ada segelnya juga, isi jg tumpah dalam kardusnya"
492,"lumayan kecewa karena ini kan official store tapi barangnya salah kirim, dan balesnya lama banget sampe keluarga yang saya bantuin beliin serum ini udah malas duluan"
493,"secara produk dan packaging saya tidak memiliki masalah. hanya saja kok adminnya perlu ditegur dan diingatkan kalau waktu batal otomatis tinggal 4 jam, baru barang pesanan saya dikirimð¤­. do better next time, somethinc. good luck!"
494,"secara produk dan packaging saya tidak memiliki masalah. hanya saja kok adminnya perlu ditegur dan diingatkan kalau waktu batal otomatis tinggal 4 jam, baru barang pesanan saya dikirimð¤­. do better next time, somethinc. good luck!"
495,jujur gak ngasih efek apa apa serumnya
496,order 2x. kedua2nys pengiriman nya sangat lama.
497,"packaging kurang aman,, musim hujan seperti ini tidak dilapisi plastic jadinya rusak karena basah, label susah dibaca kena air,, untung barangnya aman & sesuai pesanan."
498,tokopedia skrg pengirimannya lambat
499,tidak tahan lama dan baru dipake 1x makan lsg hilang. ga stay on or transferproof spt yg di claim. pas kering ada butiran2 lipstiknya jatuh2
