,Review
0,kecewa banget saya pesan yang free pouch tapi dikirimnya cotton pad kaget pas unboxing untung di videokan segera kabarin customer servicenya dan disuruh isi googleform untuk dikirimkan ulang pouchnya setelah hari nggak ada kabar akhirnya saya tanya lagi dan hanya dikabari kalau stock pouch ternyata sudah habis padahal baik baik dan sabar ikutin prosedur dari customer service karena masih berpikiran positif ternyata begini caranya ya
1,kali ini pengemasan tidak safe sepertinya tutup botol tidak kencang sehingga toner merembes keluar sampai dus basah saya memang tidak membuat video unboxing karna saya selalu mendapat produk dan packaging yg bagus dari avoskin saya kira dus basah karna hujan pas dibuka ternyata botol sudah kosong semoga mendapat tanggapan dari avoskin
2,paket datangnya barang sudah pecah dan sy return ke seller sudah ikuti komplain proses dan lain sebagainya tapi malah akhirnya tiba seakan akan pesanan selesai sy terima barang dan uangnya dilepas ke seller sy kecewa sekali dan jd agak trauma untuk beli barang ksini chat seller untuk nanyain brg ud diterima tp dijawab formalitas saja baru kali ini sy belanja brg tidak diterima tp uang tidak kembali mungkin uangnya ga seberapa cuman krn responsnya yg mengecewakan mohon improvement untuk selanjutnya thx
3,ga ada sabun nya ga sesuai deskripsi
4,ga sesuai harapan
5,nyesal beli disini
6,ga jelas
7,kalau ga da free ny di infokan lagi jangan asal acc aja
8,yang sebelumnya ada bekas jerawat malah jadi muncul di bagian yang ga pernah jerawat malah jadi jerawatan terus muncul bruntusan di beberapa bagian
9,cukup kecewa
10,pesen yang special edition dikirim yang biasa
11,pesen retinol dikirim refining
12,barang ga kekirim respon admin kurang memuaskan mohon maaf
13,iritasi
14,ternyata berat hanya gr sama kemasan gr
15,mini banget ini mah cepat habis kecewa berat
16,
17,ga ada isinya
18,hadiahnya ga dikirim kirim sudah nunggu bulan chat penjual dibilanh over load ini sudah mau bulan sangat mengecewakam pembeli percuma chat cs jawabannya sama diulang ulang
19,sedih banget ini entah ekspektasi ku ketinggian atau gimana isinya bahkan untuk sekali pakai ruas jari pun ndak cukup ditekan isinya angin semua serius memang segini atau gmna padahal sebelumnya beli di official serum dll ok ok aja isinya penuh udah seneng packagingnya bagus tebel tapi kalau memang isinya cuma segini macam sekali pakai dengan harga diatas  ok sangat tidak rekomen saya jarang banget isi review panjang kali lebar apalagi semengecewakan ini
20,yang rela beli tengah malam malah ga dapat gift dan harganya lebih mahal sistem online shop paling buruk pantas dapat bintang
21,pake ekspedisi yang bener
22,tidak ada keterangan detil mengenai ukuran berat isi produk tidak tertulis di deskripsinya bahwa isinya hanya  bahkan di foto produk juga tidak menampilkan keterangan berat dari isi produk
23,system free gift disini tidak transparan dan sangat membingungkan itulah yang mengecewakan dan layak untuk dpt bintang
24,hadiah nya tidak ada
25,system free gift disini tidak transparan dan sangat membingungkan itulah yang mengecewakan dan layak untuk dpt bintang
26,pelayanan bintang
27,botol terbuka barang tumpah
28,free giftnya smpai skrg blm dikirim beberapa  ditanyakan ke adminny cm jawab nanti dicek nanti dicek kl mmg gk niat kasih gk usah dicantumkan lain 
29,hadiah tidak ada
30,gadapet gift
31,kecewa banget ga sesuai dengan promonya di gambar kedua toko harusnya kasih retinol mask sheet tapi di gambar pertama dikasihnya pouch yang kesannya murahan dan tidak berguna sama sekali komplain di gambar ketiga ga pernah ditanggapi oleh toko yang labelnya official store sebagai official store harusnya sudah ga ada kesalahan dan ketidakbenaran hal hal sepele seperti ini di gambar keempat toko langsung update gambar produk seolah cuci tangan dalam hal pengiriman juga lelet banget giliran nanya nanya untuk beli produknya gerak cepet banget giliran komplain boro boro dibales kecewa banget
32,saya ga kecewa dgn produknya tapi saya kecewa dgn pelayanannya saya order satu dikirim untung sy jujur yah sy chat dong adminnya kok dikirim dua apa emang dpt brgnya dua sesuai dgn di gmbr adminnya blg bukan itu hanya memperlihatkan tampak depan dan belakang adminnya minta mau ga gw bayar brgnya atau balikin brg lebihnya lucu ya dia yg salah jadi nyusahin saya kalau gw ga jujur mah diem aja gw dpt dua barang saya di chat terus bisa gak dikirim balik brgnya saya bilang ok nanti saya kirim balik skr diteror mulu udah dikirim balik blm barangnya dengan saya bilang saya akan kirim balik aja udah niat baik saya di chat mulu kok jadi kayak saya yg salah yah adminnya yg salah kok jadi kaya saya yg curi barangnya yah rugi waktu tau sayang banget nih avoskin produknya bagus tapi karyawannya ga kompeten gak suka saya diteror mulu tunggu aja brgnya dtg
33,pesan oct sampai oct dalam keadaan kuyup karena sudah habis isinya 
34,isinya dikit dipencet ga keluar nyesel
35,kecewa sudah hubungi pihak avoskinnya tapi tidak di respon
36,bocor basah semuanya hampir habis essence nya
37,bocor dong sampe hampir habis sudah saya videokan pas unboxingnya juga sedih banget sih padahal selalu pake avoskin tapi baru sekarang dapet paket tumpeh tumpeh
38,barang order tidak sampai
39,salah kirim barangnya kurang toner udah gitu yang ngaco lagi barang yg salah kirim berupa sheetmask gw disuru beli coyyy literally dipaksa sih rb bukan masalah nominalnya tp masalah pelayanan yang sama sekali ga memuaskan harusnya dia tinggal ngirim lg barangnya yg kurang kan mslh selesai ga panjang  lebar kayak gini
40,yang bermasalah bukan barang ini tp kualitas pelayanan cs di sini ga bakal lg dah beli di sini
41,misal tau isinya bakal beginian ga bakal dah purchase please lah avoskin  sah pelit amat
42,tumpah semua yang di terima botol kosong
43,mau ganti pesanan gak mau dirubah alasan otomatis system padahal sy paham sekali sistem di tokped spt apa fokusnya hanya jualan bukan kepuasam pelanggan bgmna mau mempertahankan image jika byk customer yg kecewa
44,bara tiba dengan selamat tapi cs avoskin tolong diperbaiki lagi dia ngomong soal sop tapi ga paham yang saya bilang cuma minta konfirmasi pesanan karena saya udah transaksi ngomong kemana bilang sop masa harus nunggu hari untuk konfirmasi pesanan padahal udah transaksi loh udah bayar
45,
46,saya pesan masker apa kok ygdikirim malah yg ini
47,produk kemungkinan besar tidak original aroma sangat buruk seperti telur busuk saya pengguna serum avo ysb aa jadi familiar dengan baunya tapi produk ini sangat buruk baunya bahan kimia menyengat seperti telur busuk mau complain tapi sudah lewat hari hati hati aja
48,kok isinya seperti kosong isinya ga bisa keluar dari botol jadi ga bisa kepake padahal kemasan botol ampul dlm kardus segel
49,sekali pake wajah langsung breakout jerawat muncul syok padahal berharap jerawat hilang  malah muncul semua
50,sunscreen blepotan keluar dr tube sebaiknya tube di seal
51,warnanya keruh banyak gelembungnya terus baunya aneh itu gapapakah sumpah avoskin kali ini mengecewakan
52,baru kali ini biasa nya beli ini baik ajah
53,pembelian kedua kenapa dapet barang kek gini yaa apa karna barang sale encer banget creamnya udah coba masukin kulkas tapi tetep gini aman ga ya tetep dipakenya
54,isinya kosong pertama kali beli barang begini karena officialnya store jdi gak buat video dari barang barang isinya kosong
55,no review found
56,hmm agak ragu dengan produk ini baru sekali saya pakai kok jadi ada kerak putihnya gini di kulit saya ya
57,no review found
58,unproffesional with handling complain
59,sunscreen tidak sesuai foto ternyata hanya yang ml tidak dapat free wallet juga fotonya bener missleading kecewa banget
60,syng banget kulit jd kemerahan dan gatel baru coba tonnernya padahal
61,syng banget kulit jd kemerahan dan gatel baru coba tonnernya padahal
62,syng banget kulit jd kemerahan dan gatel baru coba tonnernya padahal
63,barang tidak dikirim pesanannya kurang mengecewakan sekali qc nya
64,digambarnya tertulis free toner ml ternyata tonernya tdk datang setelah chat seller katanya limited stock klo memang limited stock ko knp tdk ditulis atau dijelaskan masa sekelas official store seperti ini klo memang sdh habis yah gambarnya knp gk diganti aja ternyata banyak yg mengeluhkan hal yg sama ttg free gift yg tdk dikirim harusnya pihak store bisa memperbaiki hal tsb sisa umur simpan produk jg masa kurang dr thn hanya bln exp nov
65, purchased the first date of the campaign free mirror but the package didn  include the mirror as the campaign said their product packaging also so poor looks cheap customer admin doesn  know their campaign as well totally bad experience
66, purchased the first date of the campaign free mirror but the package didn  include the mirror as the campaign said their product packaging also so poor looks cheap customer admin doesn  know their campaign as well totally bad experience
67, purchased the first date of the campaign free mirror but the package didn  include the mirror as the campaign said their product packaging also so poor looks cheap customer admin doesn  know their campaign as well totally bad experience
68, purchased the first date of the campaign free mirror but the package didn  include the mirror as the campaign said their product packaging also so poor looks cheap customer admin doesn  know their campaign as well totally bad experience
69, purchased the first date of the campaign free mirror but the package didn  include the mirror as the campaign said their product packaging also so poor looks cheap customer admin doesn  know their campaign as well totally bad experience
70, purchased the first date of the campaign free mirror but the package didn  include the mirror as the campaign said their product packaging also so poor looks cheap customer admin doesn  know their campaign as well totally bad experience
71, purchased the first date of the campaign free mirror but the package didn  include the mirror as the campaign said their product packaging also so poor looks cheap customer admin doesn  know their campaign as well totally bad experience
72, purchased the first date of the campaign free mirror but the package didn  include the mirror as the campaign said their product packaging also so poor looks cheap customer admin doesn  know their campaign as well totally bad experience
73, purchased the first date of the campaign free mirror but the package didn  include the mirror as the campaign said their product packaging also so poor looks cheap customer admin doesn  know their campaign as well totally bad experience
74, purchased the first date of the campaign free mirror but the package didn  include the mirror as the campaign said their product packaging also so poor looks cheap customer admin doesn  know their campaign as well totally bad experience
75, purchased the first date of the campaign free mirror but the package didn  include the mirror as the campaign said their product packaging also so poor looks cheap customer admin doesn  know their campaign as well totally bad experience
76, purchased the first date of the campaign free mirror but the package didn  include the mirror as the campaign said their product packaging also so poor looks cheap customer admin doesn  know their campaign as well totally bad experience
77,ternyata yang dikirim ada bintik putihnya bukan sabun kea biasa kualitas barangnya tolong diperhatikan
78,mumpung bulan puasa jd sebelum order pikir dlu jangan termakan iklan review dr youtube rekomendasi dr youtube sblm order sudah baca deskripsi sudah memutuskan untuk membeli taunya produknya very not recomended kulit semakin kusam pkoknya kulit muka kayak terik gtu tp muka kusam mngkn krna jd kering gtu komedo yg awalnya ga keliatan jd keliatan mngkn krna kering pdhl saya menggunakan serum merk sebelah aman aman saja sudah chat penjual tp tidak memberikan solusi sm skali dan slalu mencari alasan untuk pembenaran contohnya wajib ini itu sblm pakai ini pdhl sudah jelas dideskripsi produk tidak ada penjelasannya rugi didunia ga masalah ngamburin uang beli produk ini drpd rugi akhirat menjual produk haruslah lengkap harus jelas jgn setelah order bru dikasi tw harus pakai ini dulu itu dulu alhamdulillah dalam islam saya diajarkan slalu memberikan penjelasan atas apa yg saya jual
79,terimakasih avoskin aku dapet serum yang ada banyak gumpalan didalamnya terimakasih juga buat responnya yang lama terimakasih avoskin untuk tidak tanggung jawab atas produk yang dijualnya makin seneng kalau beli barang barang cacat di toko officalnya langsung semoga aku cocok yah sama serum yang gak tau aman apa nggak ini terimakasih penerima barang cacat
80,gak videoin unboxing tapi salah kirim pesan divine ampoule yang datang malah yang ampoule sheetmask bingung mau komplain bagaimana bisa dicheck stok kalian tidak kalau memang salah kirim
81,no review found
82,isinya tumpah semua
83,no review found
84,barang seharusnya isi yg ampoule tidak ada udh isi komplain dan berbagai form komplin yg disediakan pihak avo deal katanya akan dikirim manual kekurangannya saja mohon utk dibatalkan komplainnya  tiba minta dikirim balik akan dipickup barang yg ada di saya udh di repacking dan udh di pickup oleh pihak avoskin sampe skrg status pengiriman balik dari avoskin gak jelas diminta no resi di cek not found dichat lg  dikirim resi yg berbeda aneh bukan slowrespon banget
85,no review found
86,no review found
87,beli bulan juni untuk stok karena emang langganan sama avoskin dan emang bagus tapi beli yang ke exp nya cuma sampai bulan jadi ga kepakai sama sekali tolong pihak toko perhatian lagi barang yang dijual sudah banyak complain mengenai exp barang
88,harga mahal padahal toko official tp menjual barang exp date dan sebelum dikirim sudah minta exp date yang masih panjang tapi ternyata tidak dipenuhi
89,nyelotipnya langsung ke produk jadi lengket coklat kena produknya
90,packing pake kardus cuma nyebelinnya pake diselotip kertas dan langsung nempel ke sheetmask nya ngerusak estetika produknya lain kali plis lah masukin kardus aja gausah diselotip gak guna juga selotipnya malah yg ada bikin jelek produk dan lengket
91,isinya sedikit banget malah kayak yg sudah kering isinya
92,packingnya super aman dan bahkan ketika sampai di tangan saya termasuk masih mulus bubble wrap juga tebal bahkan kotak skincarenya termasuk baik baik saja walaupun terlihat seperti produk lama yang tidak laku bahkan masa kadaluarsanya sangat singkat namun bukan masalah insyaallah bisa habis sebelum masa kadaluarsanya yang menjadi masalahnya sekarang adalah tutup skincarenya yang damage parah yang jelas bukan kesalahan kurir tapi memang dari pihak avoskin nya kalau menurut sop seharusnya ini jadi barang reject dan jika mau tetap dipasarkan saya tidak perlu membayar seharga yang mahal seharga botol mulus kecewa banget sih repurchase masih belum tau kedepannya takut dapat barang dengan masalah yang sama dan lebih takut lagi kalau sampai dapat botol yang pecah tolong pihak avoskin lebih amanah ke pembeli
93,official store avoskin sangat mengecewakan beli produk ini di bulan juni dikirim produk dengan exp date padahal pao produk bulan ngga heran di etalase toko banyak jualin produk murah yg mepet exp date tapi produk yg saya beli ini produk harga normal yg didiskon bukan produk yg dikasih keterangan mepet exp date saran mending beli produk avoskin di official store lain yg jual produk mereka beneran deh lebih mahal sedikit gapapa daripada dikasih produk mepet exp date ini official store brandnya langsung loh parah banget pelayanannya baru kali ini ada official skincare yg mau mengorbankan kepercayaan customer cuma buat menghabiskan stock produk lama
94,sayang sekali di deskripsi tertulis akan dikirim produk dengan tgl exp tapi yang dikirim tgl exp sebaiknya lebih dicek lg untuk produk yg dikirim jgn asal walau hanya selisih sebulan untuk proses pengembalian jg tidak efektif di diskusi dan penulisan alat dikasih yang berbeda customer sudah malas duluan untuk proses klaim pengembalian dan refund nya
95,dapat produk expired date sangat dekat dgn tgl kadaluarsanya tanpa pemberitahuan dahulu saya sertakan bukti foto bahwa produk saat saya beli tidak ada himbauan bahwa produk expired dalam waktu dekat pengiriman juga lama sekali lalu respon admin juga lama
96,dikasih yg exp padahal official store dan barang nya terjual sudah banyak masa masih ada yg produk tahun kemarin yg masih ada dan pembeli yg bln lalu dapat yg exp apakah karena barang diskonan jadi dikasih batch tahun lalu hmm
97,panass buanget sudah chat admin bilang gpp setiap pake nyelekit
98,tidak cocok di kulit aku yang sensitif menyebabkan iritasi kemerahaan di daerah dagu
99,isinya kosong
100,cuma bisa digunakan bulan kedepan karna exp date nya sangat mepet heran kenapa yaa toko nya cuma jual retinol yg udh dekat dgn exp date saya lihat gak ada pilihan lain cuma ini satu nya retinol ampoule pengiriman sangaaaaaaaaaat lama barang dikirim dari makasar packing gak aman karna dikirim dengan kardus yg gampang penyok inti nya sangat mengecewakan masa pakai cuma bulan sebelum exp date karna retinol tidak dipakai setiap hari jadi kemungkinan habis nya mungkin akan sangat lama saya lihat banyak keluhan exp date ini buat yg mau beli hati deh buat apa beli murah klo masa pakai nya cuma sebentar
101,no review found
102,no review found
103,no review found
104,no review found
105,no review found
106,no review found
107,no review found
108,pengiriman lama disaat seller skincare laen berlomba lomba untuk mempercepat pengiriman san avoskin malah dengan percaya dirinya berlarut larut ngirim ini produk mana produknya  aja cih
109,pengiriman lama disaat seller skincare laen berlomba lomba untuk mempercepat pengiriman san avoskin malah dengan percaya dirinya berlarut larut ngirim ini produk mana produknya  aja cih
110,sangat kecewa beli paket toner serum yg dtg cuma tonernya aja serumnya ngga ada karena udah percaya duluan jadi ga ada video unboxing abisin uang jadi musti beli serumnya lg
111,isinya habis bis basah kuyup kapok beli disini lagi udh komplain bilangnya packing sudah aman pdhal dari saya buka paket tutup botol kebuka dan isi habis gak mau disalahin kecewa pokoknya
112,no review found
113,pesanan datang tidak sesuai pesan perfect divine combo yg datang miraculous dark spot dilihat dari harga sudah jelas selisihnya serum ysb konfirmasi via chat disuruh menunggu terus akhirnya tidak bisa diretur karena shipping label blur padahal waktu sampai di tempat saya ya sudah blur seperti itu sayangnya tidak sempat buat video unboxing karena ini sudah pesanan ke dan setiap saya pesan sebelumnya tidak pernah ada kesalahan padahal setiap pesan selalu dalam jumlah yg tidak sedikit tolong lebih hati hati lg dan jika syarat retur adalah shipping label yg jelas tingkatkan kualitas shipping label kalian agar bisa saat sampai ke pelanggan tidak blur dan dibuat database agar bisa mengecek pesanan yg sudah dikirimkan ke pelanggan apa saja sudah saatnya ganti ke produk yg after sales servicenya lebih baik semoga ulasan saya tidak dihapus
114,pas datang cream nya warna nya bukan putih tp coklat setelah beberapa  jelaskan kasih histori sampai disuruh isi data baru di kirim kurir untuk pick up skrg lg menunggu gmn apakah ada pergantian krn blm dikabarin sama sekali entah krn cream nya clearance apa gmn kecewa aja krn memang butuh banget
115,no review found
116,kemasan tidak aman tp barangnya kaca semua pecah dimana
117,baru kali ini beli barang expirednya deket banget kecewa banget
118,barang sudah mau exp
119,pengiriman lama exp nya ga sampai bln sedangkan skincare pakai nya kan lama padahal official store
120,barang nya udh lama saya buka tapi blm dikeluarin dri kotaknya dan baru kali ini beli tapi kualitasnya kyk muntahan org bau dan lengket kental bgtt padahl yg sebelum nya gk gini kalau kalian bilang boong atau menjatuhkan saya gk akan berhenti pake skincare ini cuman baru kali ini dapat yang zong banget dari warna juga udh beda tulisan expired beda dri botol lain bener kyk di oplos boleh ya dilihat video nya botol pertama itu yg saya beli botol kedua itu yg udh lama saya beli juga so gimana ini kocakkk
121,barang kurang kirim pcs dah biasa beli dj sini gak pernah kurang kirim cmn  ini aja sialnya aku buka setelah transaksi selesai dan gak di videoin gak tau hrs komplain ke mana merasa sangat di rugikan
122,no review found
123,beli di kirim cm udah kirim lamaaaa kondisi barang saya terima jg seperti sudah terbuka dari segel nya
124,beli apa yang di kirim apa
125,beli toner yang di kirim serum
126,beli apa yang di kirim apa
127,barang lama di proses beli pcs bayar pcs yang datang hanya pcs itu pun juga ada keterlambatan pengiriman terimakasih pengalaman berbelanjanya
128,no review found
129,no review found
130,barang tidak di terima tidak sampai
131,no review found
132,no review found
133,req cancel karena salah beli varian tpi gk di acc diinfo barang sudah confirm kirim padahal biasanya pesanan baru diproses dihari kedua setelah dikirim ku lacak taunya kirim dari makassar padahal posisi saya di jkt jadi lama pula nyampainya sampai semingguan
134,expire date bulan tahun bulan lagi gila sih padahal di bungkus tulisan tahun ternyata tahun lain kali diinfo dong jgn ngerugiin customer
135,seller yg maksa banget buat beli barangnya padahal sudah cancel sebelum diproses tapi ditolak dan tetep ngotot barangnya dikirim barang yang bulan udh expired tetep dijual dan paksa beli hati buat yang mau belanja disini cek review dulu sebelum cekout seandainya ada bintang minus
136,di deskripsi tulisannya exp ternyata yg aku dapet malah lebih cepet exp nya padahal ini aja udah mau bulan pas di liat serumnya warna lebih keruh dari yang biasa btw sebelumny aku beli di official store jg cuma di  commerce sebelah jd pembandingnya ada pas di chat adminnya bilang msh aman tp agak ketar ketir jg lain kali beli yg exp nya msh lama aja beli yg biasa semangat girls
137,ka ko teksturny tdk sma dg yg sya liat diyoutube yah ini encer dan bening pdhl hrsunya kental dn agak putih susu wrnany apa krn tgl exp datenya kecewa bnget sih pdhl official store tokped
138,kaget pas liat exp datenya taun dgn harga normal an rb tapi dikasinya produk yg exp biasanya beli dapet exp yg lumayan jauh trus pipetnya gabisa dipakeee gajelas bgt dahlah
139,barangnya tetep blm sampai
140,diluar ekspetasi dalam pengirimannya mohon untuk direview kembali untuk produk diterima baik dan bagus
141,barang yg di terima beda seperti yg biasa dipake yg ini tekstur nya cair dan butek biasa pake bening dan tekstur nya kental dan digunakan ke wajah wajah malah jadi kusam
142,barang yang dikirim tidak sesuai saya beli niacinamide yg dikirim salicylic acid
143,toner yang ditunggu tapi pas nyampe kemasan tumpah dan tonernya abis ya allah pen nangis
144,abis pake minggu malah breakout mau klam asuransi alergi nya malah  bisa
145,yang dikirimkan bukan toner ml tp yg ml baru sempat unboxing
146,inv mpl kurang untuk gct tranexamic nya mohon dicek kembali jumlah produk tersebut yang tersisa di gudang penjual ada kelebihan satu kan nah itu punya saya semoga bisa dilakukan pengiriman kembali ya
147,inv mpl kurang untuk gct tranexamic nya mohon dicek kembali jumlah produk tersebut yang tersisa di gudang penjual ada kelebihan satu kan nah itu punya saya semoga bisa dilakukan pengiriman kembali ya
148,ga cocok
149,astaga ini expired date nya udah deket banget baru ini kecewa banget sama avo
150,sudah meminta pembatalan pesanan karena mau ganti produk dan tinggal menunggu persutujuan penjual tetapi tetap di proses seperti sengaja dan memaksa
151,dus produk rusak seperti sudah di buka
152,maaf ya saya kasih bintang soalnya essence nya susah bgt keluar meskipun ini udah diretur proses retur juga lama bgt total minggu saya baru terima barang barunya udah gt msh juga susah keluar essence nya gatau ya mungkin yg size gede ga susah ky gini not reccomend kecewa sih soalnya beli harga normal ud gt keracun org yg katanya bagus bgt tp aku sendiri susah buat coba produknya pdhl series avoskin lain yg aku punya ga ky gini
153,beli yg kombucha datangnya yg niacimide kuning bening kecewa minta pertanggungjwban tp solusinya ditukar dan hrs kirim balik barangnya trs waktuku yg terbuang gag diganti rada males trs yaudahlah dipake aja drpd nunggu lagi
154,sebotol tumpah semua kok ga  ganti
155,bru bukak sudah exsaited mw pkek  dipencet gk ada isinya cmn setetes dblg hrus di berdiriin dlu krn uk kecil logika aja ini biar uk kecil msa sekali pakai kan gk mngkn ya sngat kecewa
156,tulisannya ml tp kyk ga ada isi cuma secuil yg keluar udh di pencet isinya cuma angin pertama kali beli produk yg ga ada isi kyk gini sangat kecewa
157,pengiriman nya lama sekali
158,untuk ukuran ml kecewa banget karena isinya sumpah dikit banget cuman dari wadahnya
159,yang dipesan retinol toner tapi yang dikirim refining toner
160,review ini akan diubah jd bintang kalau dibales dengan tidak men sensor nama okeh diubah
161,gak dapat tasnya
162,udah excited banget pas produknya dateng pas dipencet nggak keluar sampe harus ke bawah banget ternyata isinya begitu memang sih cuma ml tapi kan harusnya disesuaikan juga sama ukuran tube nya jangan kayaknya gini sempet ngira dikasih sisaan loh gara begini
163,kalau misalkan ada pilihan bintang bakalan saya pilih gak worth it
164,salah kirim serum
165,segel kardusnya udah kebuka
166,pipetnya retak
167,barang bocor sampai botol kosong
168,salah kirim barang yang dikirim produk lain saya chat online toko tdk ada respon balasan
169,baru kali ini beli dan dikirim dari toko cabang ternyata pas dibuka produknya sudah rusak biasanya beli dan dikirim dari yg jogja langsung selalu aman dari awal agak curiga karena kotak kemasannya agak kotor seperti kurang dijaga ketika penyimpanan tapi tetap percaya karena sebelumnya selalu baik baik aja pelayanan ketika komplain juga kurang memuaskan
170,masker tipis packaging ga sesuai sama harga
171,barang sampai dengan selamatt
