,Review,Review_norm,review_tokens,review_tokens_SR
0,kecewa banget saya pesan yang free pouch tapi dikirimnya cotton pad kaget pas unboxing untung di videokan segera kabarin customer servicenya dan disuruh isi googleform untuk dikirimkan ulang pouchnya setelah hari nggak ada kabar akhirnya saya tanya lagi dan hanya dikabari kalau stock pouch ternyata sudah habis padahal baik baik dan sabar ikutin prosedur dari customer service karena masih berpikiran positif ternyata begini caranya ya,kecewa banget saya pesan yang free pouch tapi dikirimnya cotton pad kaget pas unboxing untung di videokan segera kabarin customer servicenya dan disuruh isi googleform untuk dikirimkan ulang pouchnya setelah hari enggak ada kabar akhirnya saya tanya lagi dan hanya dikabari kalau stock pouch ternyata sudah habis padahal baik baik dan sabar mengikuti prosedur dari customer service karena masih berpikiran positif ternyata begini caranya ya,"['kecewa', 'banget', 'saya', 'pesan', 'yang', 'free', 'pouch', 'tapi', 'dikirimnya', 'cotton', 'pad', 'kaget', 'pas', 'unboxing', 'untung', 'di', 'videokan', 'segera', 'kabarin', 'customer', 'servicenya', 'dan', 'disuruh', 'isi', 'googleform', 'untuk', 'dikirimkan', 'ulang', 'pouchnya', 'setelah', 'hari', 'enggak', 'ada', 'kabar', 'akhirnya', 'saya', 'tanya', 'lagi', 'dan', 'hanya', 'dikabari', 'kalau', 'stock', 'pouch', 'ternyata', 'sudah', 'habis', 'padahal', 'baik', 'baik', 'dan', 'sabar', 'mengikuti', 'prosedur', 'dari', 'customer', 'service', 'karena', 'masih', 'berpikiran', 'positif', 'ternyata', 'begini', 'caranya', 'ya']","['kecewa', 'banget', 'pesan', 'free', 'pouch', 'dikirimnya', 'cotton', 'pad', 'kaget', 'pas', 'unboxing', 'untung', 'videokan', 'kabarin', 'customer', 'servicenya', 'disuruh', 'isi', 'googleform', 'dikirimkan', 'ulang', 'pouchnya', 'kabar', 'dikabari', 'stock', 'pouch', 'habis', 'sabar', 'mengikuti', 'prosedur', 'customer', 'service', 'berpikiran', 'positif', 'ya']"
1,kali ini pengemasan tidak safe sepertinya tutup botol tidak kencang sehingga toner merembes keluar sampai dus basah saya memang tidak membuat video unboxing karna saya selalu mendapat produk dan packaging yg bagus dari avoskin saya kira dus basah karna hujan pas dibuka ternyata botol sudah kosong semoga mendapat tanggapan dari avoskin,kali ini pengemasan tidak safe sepertinya tutup botol tidak kencang sehingga toner merembes keluar sampai dus basah saya memang tidak membuat video unboxing karena saya selalu mendapat produk dan packaging yang bagus dari avoskin saya kira dus basah karena hujan pas dibuka ternyata botol sudah kosong semoga mendapat tanggapan dari avoskin,"['kali', 'ini', 'pengemasan', 'tidak', 'safe', 'sepertinya', 'tutup', 'botol', 'tidak', 'kencang', 'sehingga', 'toner', 'merembes', 'keluar', 'sampai', 'dus', 'basah', 'saya', 'memang', 'tidak', 'membuat', 'video', 'unboxing', 'karena', 'saya', 'selalu', 'mendapat', 'produk', 'dan', 'packaging', 'yang', 'bagus', 'dari', 'avoskin', 'saya', 'kira', 'dus', 'basah', 'karena', 'hujan', 'pas', 'dibuka', 'ternyata', 'botol', 'sudah', 'kosong', 'semoga', 'mendapat', 'tanggapan', 'dari', 'avoskin']","['kali', 'pengemasan', 'safe', 'tutup', 'botol', 'kencang', 'toner', 'merembes', 'dus', 'basah', 'video', 'unboxing', 'produk', 'packaging', 'bagus', 'avoskin', 'dus', 'basah', 'hujan', 'pas', 'dibuka', 'botol', 'kosong', 'semoga', 'tanggapan', 'avoskin']"
2,paket datangnya barang sudah pecah dan sy return ke seller sudah ikuti komplain proses dan lain sebagainya tapi malah akhirnya tiba seakan akan pesanan selesai sy terima barang dan uangnya dilepas ke seller sy kecewa sekali dan jd agak trauma untuk beli barang ksini chat seller untuk nanyain brg ud diterima tp dijawab formalitas saja baru kali ini sy belanja brg tidak diterima tp uang tidak kembali mungkin uangnya ga seberapa cuman krn responsnya yg mengecewakan mohon improvement untuk selanjutnya thx,paket datangnya barang sudah pecah dan saya return ke seller sudah ikuti komplain proses dan lain sebagainya tapi malah akhirnya tiba seakan akan pesanan selesai saya terima barang dan uangnya dilepas ke seller saya kecewa sekali dan jadi agak trauma untuk beli barang kesini chat seller untuk nanyain barang sudah diterima tapi dijawab formalitas saja baru kali ini saya belanja barang tidak diterima tapi uang tidak kembali mungkin uangnya enggak seberapa cuman karena responsnya yang mengecewakan mohon improvement untuk selanjutnya thanks,"['paket', 'datangnya', 'barang', 'sudah', 'pecah', 'dan', 'saya', 'return', 'ke', 'seller', 'sudah', 'ikuti', 'komplain', 'proses', 'dan', 'lain', 'sebagainya', 'tapi', 'malah', 'akhirnya', 'tiba', 'seakan', 'akan', 'pesanan', 'selesai', 'saya', 'terima', 'barang', 'dan', 'uangnya', 'dilepas', 'ke', 'seller', 'saya', 'kecewa', 'sekali', 'dan', 'jadi', 'agak', 'trauma', 'untuk', 'beli', 'barang', 'kesini', 'chat', 'seller', 'untuk', 'nanyain', 'barang', 'sudah', 'diterima', 'tapi', 'dijawab', 'formalitas', 'saja', 'baru', 'kali', 'ini', 'saya', 'belanja', 'barang', 'tidak', 'diterima', 'tapi', 'uang', 'tidak', 'kembali', 'mungkin', 'uangnya', 'enggak', 'seberapa', 'cuman', 'karena', 'responsnya', 'yang', 'mengecewakan', 'mohon', 'improvement', 'untuk', 'selanjutnya', 'thanks']","['paket', 'datangnya', 'barang', 'pecah', 'return', 'seller', 'ikuti', 'komplain', 'proses', 'seakan', 'pesanan', 'selesai', 'terima', 'barang', 'uangnya', 'dilepas', 'seller', 'kecewa', 'trauma', 'beli', 'barang', 'kesini', 'chat', 'seller', 'nanyain', 'barang', 'diterima', 'formalitas', 'kali', 'belanja', 'barang', 'diterima', 'uang', 'uangnya', 'cuman', 'responsnya', 'mengecewakan', 'mohon', 'improvement', 'thanks']"
3,ga ada sabun nya ga sesuai deskripsi,enggak ada sabun nya enggak sesuai deskripsi,"['enggak', 'ada', 'sabun', 'nya', 'enggak', 'sesuai', 'deskripsi']","['sabun', 'nya', 'sesuai', 'deskripsi']"
4,ga sesuai harapan,enggak sesuai harapan,"['enggak', 'sesuai', 'harapan']","['sesuai', 'harapan']"
5,nyesal beli disini,nyesal beli disini,"['nyesal', 'beli', 'disini']","['nyesal', 'beli']"
6,ga jelas,enggak jelas,"['enggak', 'jelas']",[]
7,kalau ga da free ny di infokan lagi jangan asal acc aja,kalau enggak dah free nya di infokan lagi jangan asal acc saja,"['kalau', 'enggak', 'dah', 'free', 'nya', 'di', 'infokan', 'lagi', 'jangan', 'asal', 'acc', 'saja']","['dah', 'free', 'nya', 'infokan', 'acc']"
8,yang sebelumnya ada bekas jerawat malah jadi muncul di bagian yang ga pernah jerawat malah jadi jerawatan terus muncul bruntusan di beberapa bagian,yang sebelumnya ada bekas jerawat malah jadi muncul di bagian yang enggak pernah jerawat malah jadi jerawatan terus muncul bruntusan di beberapa bagian,"['yang', 'sebelumnya', 'ada', 'bekas', 'jerawat', 'malah', 'jadi', 'muncul', 'di', 'bagian', 'yang', 'enggak', 'pernah', 'jerawat', 'malah', 'jadi', 'jerawatan', 'terus', 'muncul', 'bruntusan', 'di', 'beberapa', 'bagian']","['bekas', 'jerawat', 'muncul', 'jerawat', 'jerawatan', 'muncul', 'bruntusan']"
9,cukup kecewa,cukup kecewa,"['cukup', 'kecewa']",['kecewa']
10,sayang banget,sayang banget,"['sayang', 'banget']","['sayang', 'banget']"
11,mohon maaf tapi masih kurang,mohon maaf tapi masih kurang,"['mohon', 'maaf', 'tapi', 'masih', 'kurang']","['mohon', 'maaf']"
12,hasil pemakaian di apply biasa muncul whitecas di tap tap kok malah sperti itu ya,hasil pemakaian di apply biasa muncul whitecas di tapi tapi kok malah seperti itu ya,"['hasil', 'pemakaian', 'di', 'apply', 'biasa', 'muncul', 'whitecas', 'di', 'tapi', 'tapi', 'kok', 'malah', 'seperti', 'itu', 'ya']","['hasil', 'pemakaian', 'apply', 'muncul', 'whitecas', 'ya']"
13,sejauh ini cukup mengecewakan,sejauh ini cukup mengecewakan,"['sejauh', 'ini', 'cukup', 'mengecewakan']",['mengecewakan']
14,isinya cuma angin doang,isinya cuma angin doang,"['isinya', 'cuma', 'angin', 'doang']","['isinya', 'angin', 'doang']"
15,udah di pencet ga keluar isinya,sudah di pencet enggak keluar isinya,"['sudah', 'di', 'pencet', 'enggak', 'keluar', 'isinya']","['pencet', 'isinya']"
16,khusus ss agak kecewa susah keluar heran kenapa ngga ada versi besarnya juga ss nya,khusus ss agak kecewa susah keluar heran kenapa enggak ada versi besarnya juga ss nya,"['khusus', 'ss', 'agak', 'kecewa', 'susah', 'keluar', 'heran', 'kenapa', 'enggak', 'ada', 'versi', 'besarnya', 'juga', 'ss', 'nya']","['khusus', 'ss', 'kecewa', 'susah', 'heran', 'versi', 'besarnya', 'ss', 'nya']"
17,minta cancel krn slah pesen gk mau cancel padahal bs balasin message inbox,meminta cancel karena salah pesan enggak mau cancel padahal bisa balasin message inbox,"['meminta', 'cancel', 'karena', 'salah', 'pesan', 'enggak', 'mau', 'cancel', 'padahal', 'bisa', 'balasin', 'message', 'inbox']","['cancel', 'salah', 'pesan', 'cancel', 'balasin', 'message', 'inbox']"
18,kalau memang gabisa dicancel bilang aja gabisa admin jangan suruh nunggu batal otomatis taunya udah tinggal jam lg batal malah diproses konfirmasi sampe ke admin hasilnya ga dicancel malah dikirim kalau mau habisin stock ya blg aja gausah suruh nunggu lah apa lah service tidak professional padahal official store belanja di official store lain gapernah ribet masalah cancel hanya di avoskin saja yang baru kayak gini poor service,kalau memang enggak bisa dicancel bilang saja enggak bisa admin jangan suruh menunggu batal otomatis taunya sudah tinggal jam lagi batal malah diproses konfirmasi sampai ke admin hasilnya enggak dicancel malah dikirim kalau mau habisin stock ya bilang saja enggak usah suruh menunggu lah apa lah service tidak professional padahal official store belanja di official store lain enggak pernah ribet masalah cancel hanya di avoskin saja yang baru kayak begini poor service,"['kalau', 'memang', 'enggak', 'bisa', 'dicancel', 'bilang', 'saja', 'enggak', 'bisa', 'admin', 'jangan', 'suruh', 'menunggu', 'batal', 'otomatis', 'taunya', 'sudah', 'tinggal', 'jam', 'lagi', 'batal', 'malah', 'diproses', 'konfirmasi', 'sampai', 'ke', 'admin', 'hasilnya', 'enggak', 'dicancel', 'malah', 'dikirim', 'kalau', 'mau', 'habisin', 'stock', 'ya', 'bilang', 'saja', 'enggak', 'usah', 'suruh', 'menunggu', 'lah', 'apa', 'lah', 'service', 'tidak', 'professional', 'padahal', 'official', 'store', 'belanja', 'di', 'official', 'store', 'lain', 'enggak', 'pernah', 'ribet', 'masalah', 'cancel', 'hanya', 'di', 'avoskin', 'saja', 'yang', 'baru', 'kayak', 'begini', 'poor', 'service']","['dicancel', 'bilang', 'admin', 'suruh', 'menunggu', 'batal', 'otomatis', 'taunya', 'tinggal', 'jam', 'batal', 'diproses', 'konfirmasi', 'admin', 'hasilnya', 'dicancel', 'dikirim', 'habisin', 'stock', 'ya', 'bilang', 'suruh', 'menunggu', 'service', 'professional', 'official', 'store', 'belanja', 'official', 'store', 'ribet', 'cancel', 'avoskin', 'kayak', 'poor', 'service']"
19,dapat retinol sheet mask yg klau beli di seller lain cuma berkisar rb,dapat retinol sheet mask yang kalau beli di seller lain cuma berkisar ribu,"['dapat', 'retinol', 'sheet', 'mask', 'yang', 'kalau', 'beli', 'di', 'seller', 'lain', 'cuma', 'berkisar', 'ribu']","['retinol', 'sheet', 'mask', 'beli', 'seller', 'berkisar', 'ribu']"
20,sekelas avoskin yg hits kasi mystery box ke pembeli gini banget sheetmask beli di sebelah cuman rb tokopedia please saring lagi lah klo mau ajakin brand bikin mystery box brand lain lebih niat,sekelas avoskin yang hits kasih mystery box ke pembeli begini banget sheetmask beli di sebelah cuman ribu tokopedia please saring lagi lah kalo mau mengajak brand bikin mystery box brand lain lebih niat,"['sekelas', 'avoskin', 'yang', 'hits', 'kasih', 'mystery', 'box', 'ke', 'pembeli', 'begini', 'banget', 'sheetmask', 'beli', 'di', 'sebelah', 'cuman', 'ribu', 'tokopedia', 'please', 'saring', 'lagi', 'lah', 'kalo', 'mau', 'mengajak', 'brand', 'bikin', 'mystery', 'box', 'brand', 'lain', 'lebih', 'niat']","['sekelas', 'avoskin', 'hits', 'kasih', 'mystery', 'box', 'pembeli', 'banget', 'sheetmask', 'beli', 'sebelah', 'cuman', 'ribu', 'tokopedia', 'please', 'saring', 'kalo', 'mengajak', 'brand', 'bikin', 'mystery', 'box', 'brand', 'niat']"
21,kecewa banget pokoknya,kecewa banget pokoknya,"['kecewa', 'banget', 'pokoknya']","['kecewa', 'banget', 'pokoknya']"
22,kecewaaaaa pengiriman lama wajah jadi breakout gatau harus gimana lagi ga ngerti,kecewaaaaa pengiriman lama wajah jadi breakout enggak tau harus bagaimana lagi enggak mengerti,"['kecewaaaaa', 'pengiriman', 'lama', 'wajah', 'jadi', 'breakout', 'enggak', 'tau', 'harus', 'bagaimana', 'lagi', 'enggak', 'mengerti']","['kecewaaaaa', 'pengiriman', 'wajah', 'breakout', 'tau', 'mengerti']"
23,muka lamgsung breakout pake avoskin ini udah pengiriman lama banget terus sekalinya pake malah bikin breakout,muka lamgsung breakout pakai avoskin ini sudah pengiriman lama banget terus sekalinya pakai malah bikin breakout,"['muka', 'lamgsung', 'breakout', 'pakai', 'avoskin', 'ini', 'sudah', 'pengiriman', 'lama', 'banget', 'terus', 'sekalinya', 'pakai', 'malah', 'bikin', 'breakout']","['muka', 'lamgsung', 'breakout', 'pakai', 'avoskin', 'pengiriman', 'banget', 'sekalinya', 'pakai', 'bikin', 'breakout']"
24,selama belanja online paket ini paling lama nyampenya ternyata temen yang lain disini juga sama reviewnya semoga segera mungkin diperbaiki ya sistemnya,selama belanja online paket ini paling lama sampainya ternyata teman yang lain disini juga sama reviewnya semoga segera mungkin diperbaiki ya sistemnya,"['selama', 'belanja', 'online', 'paket', 'ini', 'paling', 'lama', 'sampainya', 'ternyata', 'teman', 'yang', 'lain', 'disini', 'juga', 'sama', 'reviewnya', 'semoga', 'segera', 'mungkin', 'diperbaiki', 'ya', 'sistemnya']","['belanja', 'online', 'paket', 'sampainya', 'teman', 'reviewnya', 'semoga', 'diperbaiki', 'ya', 'sistemnya']"
25,tim avo salah kirim barang yg dikirim toner dengan harga rb karena sdg musim pandemi saya malas kirim balik barang toh ongkir juga saya yg tanggung pastinya kan saya juga akhirnya memutuskan untuk tetap beli serum ini saya pikir hal normal klo kesalahan penjual untuk selisih bayar bukan tanggung jawab pembeli dong ya saya pikir jg rb walaupun avo juga kasih voucher untuk pembelian senilai rb saya kasih kabar cs kalau saya sudah beli serum dan dipastikan jgn ada salah kirim lagi yg saya dapatkan adalah saya diminta bayar kekurangan ya ampun bukan masalah rb sih cuma pake logika aja kalian yg salah kalian yg bkn ribet kemudian apakah diperbolehkan saya tokopedia untuk trf ke rekening seller ya,tim avo salah kirim barang yang dikirim toner dengan harga ribu karena sedang musim pandemi saya malas kirim balik barang toh ongkir juga saya yang tanggung pastinya kan saya juga akhirnya memutuskan untuk tetap beli serum ini saya pikir hal normal kalo kesalahan penjual untuk selisih bayar bukan tanggung jawab pembeli dong ya saya pikir juga ribu walaupun avo juga kasih voucher untuk pembelian senilai ribu saya kasih kabar customer service kalau saya sudah beli serum dan dipastikan jangan ada salah kirim lagi yang saya dapatkan adalah saya diminta bayar kekurangan ya ampun bukan masalah ribu sih cuma pakai logika saja kalian yang salah kalian yang bukan ribet kemudian apakah diperbolehkan saya tokopedia untuk trf ke rekening seller ya,"['tim', 'avo', 'salah', 'kirim', 'barang', 'yang', 'dikirim', 'toner', 'dengan', 'harga', 'ribu', 'karena', 'sedang', 'musim', 'pandemi', 'saya', 'malas', 'kirim', 'balik', 'barang', 'toh', 'ongkir', 'juga', 'saya', 'yang', 'tanggung', 'pastinya', 'kan', 'saya', 'juga', 'akhirnya', 'memutuskan', 'untuk', 'tetap', 'beli', 'serum', 'ini', 'saya', 'pikir', 'hal', 'normal', 'kalo', 'kesalahan', 'penjual', 'untuk', 'selisih', 'bayar', 'bukan', 'tanggung', 'jawab', 'pembeli', 'dong', 'ya', 'saya', 'pikir', 'juga', 'ribu', 'walaupun', 'avo', 'juga', 'kasih', 'voucher', 'untuk', 'pembelian', 'senilai', 'ribu', 'saya', 'kasih', 'kabar', 'customer', 'service', 'kalau', 'saya', 'sudah', 'beli', 'serum', 'dan', 'dipastikan', 'jangan', 'ada', 'salah', 'kirim', 'lagi', 'yang', 'saya', 'dapatkan', 'adalah', 'saya', 'diminta', 'bayar', 'kekurangan', 'ya', 'ampun', 'bukan', 'masalah', 'ribu', 'sih', 'cuma', 'pakai', 'logika', 'saja', 'kalian', 'yang', 'salah', 'kalian', 'yang', 'bukan', 'ribet', 'kemudian', 'apakah', 'diperbolehkan', 'saya', 'tokopedia', 'untuk', 'trf', 'ke', 'rekening', 'seller', 'ya']","['tim', 'avo', 'salah', 'kirim', 'barang', 'dikirim', 'toner', 'harga', 'ribu', 'musim', 'pandemi', 'malas', 'kirim', 'barang', 'ongkir', 'tanggung', 'pastinya', 'memutuskan', 'beli', 'serum', 'pikir', 'normal', 'kalo', 'kesalahan', 'penjual', 'selisih', 'bayar', 'tanggung', 'pembeli', 'ya', 'pikir', 'ribu', 'avo', 'kasih', 'voucher', 'pembelian', 'senilai', 'ribu', 'kasih', 'kabar', 'customer', 'service', 'beli', 'serum', 'salah', 'kirim', 'dapatkan', 'bayar', 'kekurangan', 'ya', 'ampun', 'ribu', 'sih', 'pakai', 'logika', 'salah', 'ribet', 'diperbolehkan', 'tokopedia', 'trf', 'rekening', 'seller', 'ya']"
26,kecewa,kecewa,['kecewa'],['kecewa']
27,tokok tidak amanah pembohong gak sesuai ucapan jualan asal laku aja kecewa,tokok tidak amanah pembohong enggak sesuai ucapan jualan asal laku saja kecewa,"['tokok', 'tidak', 'amanah', 'pembohong', 'enggak', 'sesuai', 'ucapan', 'jualan', 'asal', 'laku', 'saja', 'kecewa']","['tokok', 'amanah', 'pembohong', 'sesuai', 'ucapan', 'jualan', 'laku', 'kecewa']"
28,kecewa sama pembelian di toko ini saya dikirim barang rusak tapi tidak ada tanggubg jawab dan dipersulit liat deh serum nya mengkristal ga jelas gt dan tisp beli selalu aja isi produk di dalamnya berdebu,kecewa sama pembelian di toko ini saya dikirim barang rusak tapi tidak ada tanggubg jawab dan dipersulit lihat deh serum nya mengkristal enggak jelas begitu dan tisp beli selalu saja isi produk di dalamnya berdebu,"['kecewa', 'sama', 'pembelian', 'di', 'toko', 'ini', 'saya', 'dikirim', 'barang', 'rusak', 'tapi', 'tidak', 'ada', 'tanggubg', 'jawab', 'dan', 'dipersulit', 'lihat', 'deh', 'serum', 'nya', 'mengkristal', 'enggak', 'jelas', 'begitu', 'dan', 'tisp', 'beli', 'selalu', 'saja', 'isi', 'produk', 'di', 'dalamnya', 'berdebu']","['kecewa', 'pembelian', 'toko', 'dikirim', 'barang', 'rusak', 'tanggubg', 'dipersulit', 'lihat', 'deh', 'serum', 'nya', 'mengkristal', 'tisp', 'beli', 'isi', 'produk', 'dalamnya', 'berdebu']"
29,belum terlihat manfaatnya,belum terlihat manfaatnya,"['belum', 'terlihat', 'manfaatnya']",['manfaatnya']
30,suncreen spf isinya kosong ngak ngerti dengan qcnya,suncreen spf isinya kosong enggak mengerti dengan qcnya,"['suncreen', 'spf', 'isinya', 'kosong', 'enggak', 'mengerti', 'dengan', 'qcnya']","['suncreen', 'spf', 'isinya', 'kosong', 'mengerti', 'qcnya']"
31,dari awal menerima isi udah berkurang cukup bnyak kali prtama kecewa,dari awal menerima isi sudah berkurang cukup banyak kali prtama kecewa,"['dari', 'awal', 'menerima', 'isi', 'sudah', 'berkurang', 'cukup', 'banyak', 'kali', 'prtama', 'kecewa']","['menerima', 'isi', 'berkurang', 'kali', 'prtama', 'kecewa']"
32,gak ada isinya kecewa banget,enggak ada isinya kecewa banget,"['enggak', 'ada', 'isinya', 'kecewa', 'banget']","['isinya', 'kecewa', 'banget']"
33,bruntusan,bruntusan,['bruntusan'],['bruntusan']
34,ga cocok banget sm kulitku sedih bawah mata bengkak pdahal baru pake kali spertinya alergi sm bbrp bahan di dalamnya sayang banget,enggak cocok banget sama kulitku sedih bawah mata bengkak padahal baru pakai kali sepertinya alergi sama beberapa bahan di dalamnya sayang banget,"['enggak', 'cocok', 'banget', 'sama', 'kulitku', 'sedih', 'bawah', 'mata', 'bengkak', 'padahal', 'baru', 'pakai', 'kali', 'sepertinya', 'alergi', 'sama', 'beberapa', 'bahan', 'di', 'dalamnya', 'sayang', 'banget']","['cocok', 'banget', 'kulitku', 'sedih', 'mata', 'bengkak', 'pakai', 'kali', 'alergi', 'bahan', 'dalamnya', 'sayang', 'banget']"
35,aku pesen pcs toner essence  dikabari ekspedisi dusnya rembes air sedih padahal tonerku udh tiris jdinya kutolak paketnya ujungnya duit dibalikin huft bikin lama lagi di video yg dikirimin ekspedisi terlihat tonernya ini aman gak berkurang sama skali tp mau ga mau kubalikin nya,aku pesan pcs toner essence  dikabari ekspedisi dusnya rembes air sedih padahal tonerku sudah tiris jdinya kutolak paketnya ujungnya duit dibalikin huft bikin lama lagi di video yang dikirimin ekspedisi terlihat tonernya ini aman enggak berkurang sama sekali tapi mau enggak mau kubalikin nya,"['aku', 'pesan', 'pcs', 'toner', 'essence', 'dikabari', 'ekspedisi', 'dusnya', 'rembes', 'air', 'sedih', 'padahal', 'tonerku', 'sudah', 'tiris', 'jdinya', 'kutolak', 'paketnya', 'ujungnya', 'duit', 'dibalikin', 'huft', 'bikin', 'lama', 'lagi', 'di', 'video', 'yang', 'dikirimin', 'ekspedisi', 'terlihat', 'tonernya', 'ini', 'aman', 'enggak', 'berkurang', 'sama', 'sekali', 'tapi', 'mau', 'enggak', 'mau', 'kubalikin', 'nya']","['pesan', 'pcs', 'toner', 'essence', 'dikabari', 'ekspedisi', 'dusnya', 'rembes', 'air', 'sedih', 'tonerku', 'tiris', 'jdinya', 'kutolak', 'paketnya', 'ujungnya', 'duit', 'dibalikin', 'huft', 'bikin', 'video', 'dikirimin', 'ekspedisi', 'tonernya', 'aman', 'berkurang', 'kubalikin', 'nya']"
36,bocor paket basah sedih,bocor paket basah sedih,"['bocor', 'paket', 'basah', 'sedih']","['bocor', 'paket', 'basah', 'sedih']"
37,ga kebayang kalo sunscreen ml itu stlh dipencet isinya hampir ga ada maaf ya tapi mending ganti sku yg lbh banyak ml nya,enggak terbayang kalo sunscreen ml itu setelah dipencet isinya hampir enggak ada maaf ya tapi mending ganti sku yang lebih banyak ml nya,"['enggak', 'terbayang', 'kalo', 'sunscreen', 'ml', 'itu', 'setelah', 'dipencet', 'isinya', 'hampir', 'enggak', 'ada', 'maaf', 'ya', 'tapi', 'mending', 'ganti', 'sku', 'yang', 'lebih', 'banyak', 'ml', 'nya']","['terbayang', 'kalo', 'sunscreen', 'ml', 'dipencet', 'isinya', 'maaf', 'ya', 'mending', 'ganti', 'sku', 'ml', 'nya']"
38,udah pede ga akan ada masalah karena dari official store jadi pas buka ga divideo taunya ada satu yg atasnya udah sobek gitu dan tentunya semua essencenya kering sudah lesson learned jaman skrg memang semua paket harus video unboxing bahkan dari toko terpercaya sekalipun,sudah percaya diri enggak akan ada masalah karena dari official store jadi pas buka enggak divideo taunya ada satu yang atasnya sudah sobek begitu dan tentunya semua essencenya kering sudah lesson learned jaman sekarang memang semua paket harus video unboxing bahkan dari toko terpercaya sekalipun,"['sudah', 'percaya', 'diri', 'enggak', 'akan', 'ada', 'masalah', 'karena', 'dari', 'official', 'store', 'jadi', 'pas', 'buka', 'enggak', 'divideo', 'taunya', 'ada', 'satu', 'yang', 'atasnya', 'sudah', 'sobek', 'begitu', 'dan', 'tentunya', 'semua', 'essencenya', 'kering', 'sudah', 'lesson', 'learned', 'jaman', 'sekarang', 'memang', 'semua', 'paket', 'harus', 'video', 'unboxing', 'bahkan', 'dari', 'toko', 'terpercaya', 'sekalipun']","['percaya', 'official', 'store', 'pas', 'buka', 'divideo', 'taunya', 'atasnya', 'sobek', 'essencenya', 'kering', 'lesson', 'learned', 'jaman', 'paket', 'video', 'unboxing', 'toko', 'terpercaya']"
39,hasilnya belom nampak udah minggu pemakaian,hasilnya belum menampak sudah minggu pemakaian,"['hasilnya', 'belum', 'menampak', 'sudah', 'minggu', 'pemakaian']","['hasilnya', 'menampak', 'minggu', 'pemakaian']"
40,segel plastik  sdh gk ada pas  buka krtas dlm  udh robek kek udh di unboxing,segel plastik  sudah enggak ada pas  buka krtas dalam  sudah robek kayak sudah di unboxing,"['segel', 'plastik', 'sudah', 'enggak', 'ada', 'pas', 'buka', 'krtas', 'dalam', 'sudah', 'robek', 'kayak', 'sudah', 'di', 'unboxing']","['segel', 'plastik', 'pas', 'buka', 'krtas', 'robek', 'kayak', 'unboxing']"
41,tutup tidak rapat bocor sampai isinya habis proses komplain ribet sekali harus kirim balik kemasan kosongnya,tutup tidak rapat bocor sampai isinya habis proses komplain ribet sekali harus kirim balik kemasan kosongnya,"['tutup', 'tidak', 'rapat', 'bocor', 'sampai', 'isinya', 'habis', 'proses', 'komplain', 'ribet', 'sekali', 'harus', 'kirim', 'balik', 'kemasan', 'kosongnya']","['tutup', 'rapat', 'bocor', 'isinya', 'habis', 'proses', 'komplain', 'ribet', 'kirim', 'kemasan', 'kosongnya']"
42,no review found,no review found,"['no', 'review', 'found']","['no', 'review', 'found']"
43,tidak diberikan bonus sesuai deskripsi,tidak diberikan bonus sesuai deskripsi,"['tidak', 'diberikan', 'bonus', 'sesuai', 'deskripsi']","['bonus', 'sesuai', 'deskripsi']"
44,timbul banyak jerawat kecil,timbul banyak jerawat kecil,"['timbul', 'banyak', 'jerawat', 'kecil']","['timbul', 'jerawat']"
45,gak cocok bikin gatal dan iritasi pas pemakaian minggu coba berhenti minggu trus pake lagi ternyata sama aja gatal dan iritasi jd breakout gitu,enggak cocok bikin gatal dan iritasi pas pemakaian minggu coba berhenti minggu terus pakai lagi ternyata sama saja gatal dan iritasi jadi breakout begitu,"['enggak', 'cocok', 'bikin', 'gatal', 'dan', 'iritasi', 'pas', 'pemakaian', 'minggu', 'coba', 'berhenti', 'minggu', 'terus', 'pakai', 'lagi', 'ternyata', 'sama', 'saja', 'gatal', 'dan', 'iritasi', 'jadi', 'breakout', 'begitu']","['cocok', 'bikin', 'gatal', 'iritasi', 'pas', 'pemakaian', 'minggu', 'coba', 'berhenti', 'minggu', 'pakai', 'gatal', 'iritasi', 'breakout']"
46,kok bisa isinya kosong aduhhh,kok bisa isinya kosong aduh,"['kok', 'bisa', 'isinya', 'kosong', 'aduh']","['isinya', 'kosong', 'aduh']"
47,aku senang dapat pc nya yoongi tapi aku kecewa sama barangnya aku mau coba make sunscreennya udah aku pencet kok gak mau keluar ternyata isinya udah mau habis,aku senang dapat pc nya yoongi tapi aku kecewa sama barangnya aku mau coba memakai sunscreennya sudah aku pencet kok enggak mau keluar ternyata isinya sudah mau habis,"['aku', 'senang', 'dapat', 'pc', 'nya', 'yoongi', 'tapi', 'aku', 'kecewa', 'sama', 'barangnya', 'aku', 'mau', 'coba', 'memakai', 'sunscreennya', 'sudah', 'aku', 'pencet', 'kok', 'enggak', 'mau', 'keluar', 'ternyata', 'isinya', 'sudah', 'mau', 'habis']","['senang', 'pc', 'nya', 'yoongi', 'kecewa', 'barangnya', 'coba', 'memakai', 'sunscreennya', 'pencet', 'isinya', 'habis']"
