,Review,Review_norm,review_tokens,review_tokens_SR
252,ini pertama kali saya membeli serum avoskin jujur untuk produk serumnya sejauh ini tidak ada komplain namun saat saya terima pipet pumpnya tidak berfungsi serum tidak tersedot dan tidak bisa keluar begitu dicoba pakai pipet pump serum merk lain dengan effortless lgsg tersedot dan keluar hanya dengan sekali pencet lalu saya minta tolong replace pump ke tim cs awalnya dioper untuk kirim video ke whatsapp lalu sudah saya lakukan sampai hampir minggu kemudian saya tunggu dengan sabar tapi belum ada kabar jadi saya followup lalu tim cs di whatsapp mengoper saya lagi ke tokped saya followup lagi di tokped lalu dibilang karena serumnya kental dan saya tidak paham cara pakai serum bener bener nggak habis pikir karena udah usaha bikin video sejelas mungkin kalau pipetnya nggak berfungsi dan langsung berfungsi dengan pipet lain jadi udah jelas bukan salah serumnya saya jelasin lagi dengan detail tapi terus diputer puter segitu beratnya untuk replace pump aja sayang sekali produk yang bagus harus mengecewakan customer karena sdm nya untuk yang baru mau coba serum avoskin semoga pumpnya nggak rusak kayak punya saya yaa kalau rusak pake pipet serum lain aja daripada buang waktu untuk komplain terima kasih avoskin sukses selalu,ini pertama kali saya membeli serum avoskin jujur untuk produk serumnya sejauh ini tidak ada komplain namun saat saya terima pipet pumpnya tidak berfungsi serum tidak tersedot dan tidak bisa keluar begitu dicoba pakai pipet pump serum merk lain dengan effortless langsung tersedot dan keluar hanya dengan sekali pencet lalu saya meminta tolong replace pump ke tim customer service awalnya dioper untuk kirim video ke whatsapp lalu sudah saya lakukan sampai hampir minggu kemudian saya tunggu dengan sabar tapi belum ada kabar jadi saya followup lalu tim customer service di whatsapp mengoper saya lagi ke tokped saya followup lagi di tokped lalu dibilang karena serumnya kental dan saya tidak paham cara pakai serum benar benar enggak habis pikir karena sudah usaha bikin video sejelas mungkin kalau pipetnya enggak berfungsi dan langsung berfungsi dengan pipet lain jadi sudah jelas bukan salah serumnya saya jelasin lagi dengan detail tapi terus diputer puter segitu beratnya untuk replace pump saja sayang sekali produk yang bagus harus mengecewakan customer karena sdm nya untuk yang baru mau coba serum avoskin semoga pumpnya enggak rusak kayak punya saya ya kalau rusak pakai pipet serum lain saja daripada buang waktu untuk komplain terima kasih avoskin sukses selalu,"['ini', 'pertama', 'kali', 'saya', 'membeli', 'serum', 'avoskin', 'jujur', 'untuk', 'produk', 'serumnya', 'sejauh', 'ini', 'tidak', 'ada', 'komplain', 'namun', 'saat', 'saya', 'terima', 'pipet', 'pumpnya', 'tidak', 'berfungsi', 'serum', 'tidak', 'tersedot', 'dan', 'tidak', 'bisa', 'keluar', 'begitu', 'dicoba', 'pakai', 'pipet', 'pump', 'serum', 'merk', 'lain', 'dengan', 'effortless', 'langsung', 'tersedot', 'dan', 'keluar', 'hanya', 'dengan', 'sekali', 'pencet', 'lalu', 'saya', 'meminta', 'tolong', 'replace', 'pump', 'ke', 'tim', 'customer', 'service', 'awalnya', 'dioper', 'untuk', 'kirim', 'video', 'ke', 'whatsapp', 'lalu', 'sudah', 'saya', 'lakukan', 'sampai', 'hampir', 'minggu', 'kemudian', 'saya', 'tunggu', 'dengan', 'sabar', 'tapi', 'belum', 'ada', 'kabar', 'jadi', 'saya', 'followup', 'lalu', 'tim', 'customer', 'service', 'di', 'whatsapp', 'mengoper', 'saya', 'lagi', 'ke', 'tokped', 'saya', 'followup', 'lagi', 'di', 'tokped', 'lalu', 'dibilang', 'karena', 'serumnya', 'kental', 'dan', 'saya', 'tidak', 'paham', 'cara', 'pakai', 'serum', 'benar', 'benar', 'enggak', 'habis', 'pikir', 'karena', 'sudah', 'usaha', 'bikin', 'video', 'sejelas', 'mungkin', 'kalau', 'pipetnya', 'enggak', 'berfungsi', 'dan', 'langsung', 'berfungsi', 'dengan', 'pipet', 'lain', 'jadi', 'sudah', 'jelas', 'bukan', 'salah', 'serumnya', 'saya', 'jelasin', 'lagi', 'dengan', 'detail', 'tapi', 'terus', 'diputer', 'puter', 'segitu', 'beratnya', 'untuk', 'replace', 'pump', 'saja', 'sayang', 'sekali', 'produk', 'yang', 'bagus', 'harus', 'mengecewakan', 'customer', 'karena', 'sdm', 'nya', 'untuk', 'yang', 'baru', 'mau', 'coba', 'serum', 'avoskin', 'semoga', 'pumpnya', 'enggak', 'rusak', 'kayak', 'punya', 'saya', 'ya', 'kalau', 'rusak', 'pakai', 'pipet', 'serum', 'lain', 'saja', 'daripada', 'buang', 'waktu', 'untuk', 'komplain', 'terima', 'kasih', 'avoskin', 'sukses', 'selalu']","['kali', 'membeli', 'serum', 'avoskin', 'jujur', 'produk', 'serumnya', 'komplain', 'terima', 'pipet', 'pumpnya', 'berfungsi', 'serum', 'tersedot', 'dicoba', 'pakai', 'pipet', 'pump', 'serum', 'merk', 'effortless', 'langsung', 'tersedot', 'pencet', 'tolong', 'replace', 'pump', 'tim', 'customer', 'service', 'dioper', 'kirim', 'video', 'whatsapp', 'lakukan', 'minggu', 'tunggu', 'sabar', 'kabar', 'followup', 'tim', 'customer', 'service', 'whatsapp', 'mengoper', 'tokped', 'followup', 'tokped', 'dibilang', 'serumnya', 'kental', 'paham', 'pakai', 'serum', 'habis', 'pikir', 'usaha', 'bikin', 'video', 'sejelas', 'pipetnya', 'berfungsi', 'langsung', 'berfungsi', 'pipet', 'salah', 'serumnya', 'jelasin', 'detail', 'diputer', 'puter', 'segitu', 'beratnya', 'replace', 'pump', 'sayang', 'produk', 'bagus', 'mengecewakan', 'customer', 'sdm', 'nya', 'coba', 'serum', 'avoskin', 'semoga', 'pumpnya', 'rusak', 'kayak', 'ya', 'rusak', 'pakai', 'pipet', 'serum', 'buang', 'komplain', 'terima', 'kasih', 'avoskin', 'sukses']"
253,warna sudah kuning apa bisa diganti,warna sudah kuning apa bisa diganti,"['warna', 'sudah', 'kuning', 'apa', 'bisa', 'diganti']","['warna', 'kuning', 'diganti']"
254,ternyata isinya cuma gram tulisnya kemasan gr kecewa,ternyata isinya cuma gram tulisnya kemasan gram kecewa,"['ternyata', 'isinya', 'cuma', 'gram', 'tulisnya', 'kemasan', 'gram', 'kecewa']","['isinya', 'gram', 'tulisnya', 'kemasan', 'gram', 'kecewa']"
255,lama bgt pesen kamis dikirim senin,lama banget pesan kamis dikirim senin,"['lama', 'banget', 'pesan', 'kamis', 'dikirim', 'senin']","['banget', 'pesan', 'kamis', 'dikirim', 'senin']"
256,pesannya yg no tapi dikirim no,pesannya yang no tapi dikirim no,"['pesannya', 'yang', 'no', 'tapi', 'dikirim', 'no']","['pesannya', 'no', 'dikirim', 'no']"
257, males drama bgt avoskin mending cancel dr toko ka drpd dikirim yg ga sesuai pesen acne spot yg dikirim malah masker, malas drama banget avoskin mending cancel dari toko kak daripada dikirim yang enggak sesuai pesan acne spot yang dikirim malah masker,"['malas', 'drama', 'banget', 'avoskin', 'mending', 'cancel', 'dari', 'toko', 'kak', 'daripada', 'dikirim', 'yang', 'enggak', 'sesuai', 'pesan', 'acne', 'spot', 'yang', 'dikirim', 'malah', 'masker']","['malas', 'drama', 'banget', 'avoskin', 'mending', 'cancel', 'toko', 'kak', 'dikirim', 'sesuai', 'pesan', 'acne', 'spot', 'dikirim', 'masker']"
258,beli pcs dikirim pcs ga ridho sampai kapan pun buat yg packing amanah konsumen itu di jaga kerja yg teliti,beli pcs dikirim pcs enggak ridho sampai kapan pun buat yang packing amanah konsumen itu di jaga kerja yang teliti,"['beli', 'pcs', 'dikirim', 'pcs', 'enggak', 'ridho', 'sampai', 'kapan', 'pun', 'buat', 'yang', 'packing', 'amanah', 'konsumen', 'itu', 'di', 'jaga', 'kerja', 'yang', 'teliti']","['beli', 'pcs', 'dikirim', 'pcs', 'ridho', 'packing', 'amanah', 'konsumen', 'jaga', 'kerja', 'teliti']"
259,pesan dikirim hati ini official store kerjaan ga becus ga tau diganti atau kaga,pesan dikirim hati ini official store pekerjaan enggak becus enggak tau diganti atau kagak,"['pesan', 'dikirim', 'hati', 'ini', 'official', 'store', 'pekerjaan', 'enggak', 'becus', 'enggak', 'tau', 'diganti', 'atau', 'kagak']","['pesan', 'dikirim', 'hati', 'official', 'store', 'pekerjaan', 'becus', 'tau', 'diganti', 'kagak']"
260,pesan dikirim hati dengan toko ini kerjaan tidak becus nga tau diganti atau tidak,pesan dikirim hati dengan toko ini pekerjaan tidak becus enggak tau diganti atau tidak,"['pesan', 'dikirim', 'hati', 'dengan', 'toko', 'ini', 'pekerjaan', 'tidak', 'becus', 'enggak', 'tau', 'diganti', 'atau', 'tidak']","['pesan', 'dikirim', 'hati', 'toko', 'pekerjaan', 'becus', 'tau', 'diganti']"
261,war flashsale tapi paket hilang kecewa sih mana war nya susah bukan di ganti produk cm di refund aja,war flashsale tapi paket hilang kecewa sih mana war nya susah bukan di ganti produk cuma di refund saja,"['war', 'flashsale', 'tapi', 'paket', 'hilang', 'kecewa', 'sih', 'mana', 'war', 'nya', 'susah', 'bukan', 'di', 'ganti', 'produk', 'cuma', 'di', 'refund', 'saja']","['war', 'flashsale', 'paket', 'hilang', 'kecewa', 'sih', 'war', 'nya', 'susah', 'ganti', 'produk', 'refund']"
262,barang belum diterima,barang belum diterima,"['barang', 'belum', 'diterima']","['barang', 'diterima']"
263,biasanya kiriman komplit tapi pas pesenan ini ko beli datengnya cuman,biasanya kiriman komplit tapi pas pesanan ini kok beli datengnya cuman,"['biasanya', 'kiriman', 'komplit', 'tapi', 'pas', 'pesanan', 'ini', 'kok', 'beli', 'datengnya', 'cuman']","['kiriman', 'komplit', 'pas', 'pesanan', 'beli', 'datengnya', 'cuman']"
264,barang yg dikirim tidak sesuai,barang yang dikirim tidak sesuai,"['barang', 'yang', 'dikirim', 'tidak', 'sesuai']","['barang', 'dikirim', 'sesuai']"
265,sedih beli acne solution dikirimnya masker kecewa sih sekelas avoskin toko besar tpi drama,sedih beli acne solution dikirimnya masker kecewa sih sekelas avoskin toko besar tapi drama,"['sedih', 'beli', 'acne', 'solution', 'dikirimnya', 'masker', 'kecewa', 'sih', 'sekelas', 'avoskin', 'toko', 'besar', 'tapi', 'drama']","['sedih', 'beli', 'acne', 'solution', 'dikirimnya', 'masker', 'kecewa', 'sih', 'sekelas', 'avoskin', 'toko', 'drama']"
266,barang tidak sesuai,barang tidak sesuai,"['barang', 'tidak', 'sesuai']","['barang', 'sesuai']"
267,parah si kesalahan seller dikasi nya sheet mask,parah sih kesalahan seller dikasih nya sheet mask,"['parah', 'sih', 'kesalahan', 'seller', 'dikasih', 'nya', 'sheet', 'mask']","['parah', 'sih', 'kesalahan', 'seller', 'dikasih', 'nya', 'sheet', 'mask']"
268,sampah,sampah,['sampah'],['sampah']
269,kalau memang salah dari seller di cancel saja dari sana jangan dikirim dengan barang berbeda kan ga semua orang butuh apa yg dikirimkan makanya pas upload diskon benerin liatnya,kalau memang salah dari seller di cancel saja dari sana jangan dikirim dengan barang berbeda kan enggak semua orang butuh apa yang dikirimkan makanya pas upload diskon benerin lihatnya,"['kalau', 'memang', 'salah', 'dari', 'seller', 'di', 'cancel', 'saja', 'dari', 'sana', 'jangan', 'dikirim', 'dengan', 'barang', 'berbeda', 'kan', 'enggak', 'semua', 'orang', 'butuh', 'apa', 'yang', 'dikirimkan', 'makanya', 'pas', 'upload', 'diskon', 'benerin', 'lihatnya']","['salah', 'seller', 'cancel', 'dikirim', 'barang', 'berbeda', 'orang', 'butuh', 'dikirimkan', 'pas', 'upload', 'diskon', 'benerin', 'lihatnya']"
270,expired bulan depan,expired bulan depan,"['expired', 'bulan', 'depan']",['expired']
271,ga cocokkkk,enggak cocok,"['enggak', 'cocok']",['cocok']
272,benar kecewa pakai avoskin sudah lebih dr tahun baru kali ini kapok dgn servicenya silakan teman konsumen nilai sendiri dari bukti foto saya seriously pasti banyak yg udah percaya dgn brand ini sehingga tidak merekam proses membuka paket seperti saya tuhan maha tahu tentang kebenaran okelah saya rugi rb tapi jangan harap saya mau membeli lagi atau mempromosikan brand ini lagi ke lingkungan saya,benar kecewa pakai avoskin sudah lebih dari tahun baru kali ini kapok dengan servicenya silakan teman konsumen nilai sendiri dari bukti foto saya seriously pasti banyak yang sudah percaya dengan brand ini sehingga tidak merekam proses membuka paket seperti saya tuhan maha tahu tentang kebenaran okelah saya rugi ribu tapi jangan harap saya mau membeli lagi atau mempromosikan brand ini lagi ke lingkungan saya,"['benar', 'kecewa', 'pakai', 'avoskin', 'sudah', 'lebih', 'dari', 'tahun', 'baru', 'kali', 'ini', 'kapok', 'dengan', 'servicenya', 'silakan', 'teman', 'konsumen', 'nilai', 'sendiri', 'dari', 'bukti', 'foto', 'saya', 'seriously', 'pasti', 'banyak', 'yang', 'sudah', 'percaya', 'dengan', 'brand', 'ini', 'sehingga', 'tidak', 'merekam', 'proses', 'membuka', 'paket', 'seperti', 'saya', 'tuhan', 'maha', 'tahu', 'tentang', 'kebenaran', 'okelah', 'saya', 'rugi', 'ribu', 'tapi', 'jangan', 'harap', 'saya', 'mau', 'membeli', 'lagi', 'atau', 'mempromosikan', 'brand', 'ini', 'lagi', 'ke', 'lingkungan', 'saya']","['kecewa', 'pakai', 'avoskin', 'kali', 'kapok', 'servicenya', 'silakan', 'teman', 'konsumen', 'nilai', 'bukti', 'foto', 'seriously', 'percaya', 'brand', 'merekam', 'proses', 'membuka', 'paket', 'tuhan', 'maha', 'kebenaran', 'okelah', 'rugi', 'ribu', 'harap', 'membeli', 'mempromosikan', 'brand', 'lingkungan']"
273,dikirimi box kosong dan perlu nunggu serta follow up selama bulan,dikirimi box kosong dan perlu menunggu serta follow up selama bulan,"['dikirimi', 'box', 'kosong', 'dan', 'perlu', 'menunggu', 'serta', 'follow', 'up', 'selama', 'bulan']","['dikirimi', 'box', 'kosong', 'menunggu', 'follow', 'up']"
274,barang yg dikirim beda dengan yg dipesan,barang yang dikirim beda dengan yang dipesan,"['barang', 'yang', 'dikirim', 'beda', 'dengan', 'yang', 'dipesan']","['barang', 'dikirim', 'beda', 'dipesan']"
275, never received the products for over month waiting and now waiting for tokopedia to make refund  waste of time, never received the products for over month waiting and now waiting for tokopedia tapi memakai refund  waste of time,"['never', 'received', 'the', 'products', 'for', 'over', 'month', 'waiting', 'and', 'now', 'waiting', 'for', 'tokopedia', 'tapi', 'memakai', 'refund', 'waste', 'of', 'time']","['never', 'received', 'the', 'products', 'for', 'over', 'month', 'waiting', 'and', 'now', 'waiting', 'for', 'tokopedia', 'memakai', 'refund', 'waste', 'of', 'time']"
276,bikin jerawatan sudah bulan pakai malah makin parah mending gk pakai,bikin jerawatan sudah bulan pakai malah makin parah mending enggak pakai,"['bikin', 'jerawatan', 'sudah', 'bulan', 'pakai', 'malah', 'makin', 'parah', 'mending', 'enggak', 'pakai']","['bikin', 'jerawatan', 'pakai', 'parah', 'mending', 'pakai']"
277,setelah pakai bulan malah jerawatan parah padahal dulu gk separah ini menyesal pakainya,setelah pakai bulan malah jerawatan parah padahal dulu enggak separah ini menyesal pakainya,"['setelah', 'pakai', 'bulan', 'malah', 'jerawatan', 'parah', 'padahal', 'dulu', 'enggak', 'separah', 'ini', 'menyesal', 'pakainya']","['pakai', 'jerawatan', 'parah', 'separah', 'menyesal', 'pakainya']"
278,pengiriman lama pesan toner dikirim serum serum yg dikirim exp bulan udah mo expired trik buat abisin barang exp refund ribet wong yg salah sapa yg buat rib,pengiriman lama pesan toner dikirim serum serum yang dikirim exp bulan sudah mau expired trik buat abisin barang exp refund ribet wong yang salah sapa yang buat rib,"['pengiriman', 'lama', 'pesan', 'toner', 'dikirim', 'serum', 'serum', 'yang', 'dikirim', 'exp', 'bulan', 'sudah', 'mau', 'expired', 'trik', 'buat', 'abisin', 'barang', 'exp', 'refund', 'ribet', 'wong', 'yang', 'salah', 'sapa', 'yang', 'buat', 'rib']","['pengiriman', 'pesan', 'toner', 'dikirim', 'serum', 'serum', 'dikirim', 'exp', 'expired', 'trik', 'abisin', 'barang', 'exp', 'refund', 'ribet', 'salah', 'sapa', 'rib']"
279,isinya seperti sudah expired baunya ga sedap beda dgn pembelian ku yg sblmnya please mau direfund atau tuker item baru aja rugi banget asli,isinya seperti sudah expired baunya enggak sedap beda dengan pembelian ku yang sebelumnya please mau direfund atau tuker item baru saja rugi banget asli,"['isinya', 'seperti', 'sudah', 'expired', 'baunya', 'enggak', 'sedap', 'beda', 'dengan', 'pembelian', 'ku', 'yang', 'sebelumnya', 'please', 'mau', 'direfund', 'atau', 'tuker', 'item', 'baru', 'saja', 'rugi', 'banget', 'asli']","['isinya', 'expired', 'baunya', 'sedap', 'beda', 'pembelian', 'ku', 'please', 'direfund', 'tuker', 'item', 'rugi', 'banget', 'asli']"
280,salah kirim yg dateng malah niacinamide tolong diperhatikan dalam mengemas barangnya,salah kirim yang datang malah niacinamide tolong diperhatikan dalam mengemas barangnya,"['salah', 'kirim', 'yang', 'datang', 'malah', 'niacinamide', 'tolong', 'diperhatikan', 'dalam', 'mengemas', 'barangnya']","['salah', 'kirim', 'niacinamide', 'tolong', 'diperhatikan', 'mengemas', 'barangnya']"
281,semoga avoskin makin laris sehingga bisa mensejahterakan karyawannya biar makin semangat konsentrasi dalam bekerja,semoga avoskin makin laris sehingga bisa mensejahterakan karyawannya biar makin semangat konsentrasi dalam bekerja,"['semoga', 'avoskin', 'makin', 'laris', 'sehingga', 'bisa', 'mensejahterakan', 'karyawannya', 'biar', 'makin', 'semangat', 'konsentrasi', 'dalam', 'bekerja']","['semoga', 'avoskin', 'laris', 'mensejahterakan', 'karyawannya', 'biar', 'semangat', 'konsentrasi']"
282,pertama kali belanja di official store avoskin produknya ga ada masalah tapi logistiknya lama semoga jadi bahan evaluasi avoskin untuk bermitra dengan anteraja karena bisa mempengaruhi kepuasan pelanggan walaupun produknya tidak ada masalah ecommerce sebelah kurir bebas ongkir nya ga selambat ini,pertama kali belanja di official store avoskin produknya enggak ada masalah tapi logistiknya lama semoga jadi bahan evaluasi avoskin untuk bermitra dengan anteraja karena bisa mempengaruhi kepuasan pelanggan walaupun produknya tidak ada masalah ecommerce sebelah kurir bebas ongkir nya enggak selambat ini,"['pertama', 'kali', 'belanja', 'di', 'official', 'store', 'avoskin', 'produknya', 'enggak', 'ada', 'masalah', 'tapi', 'logistiknya', 'lama', 'semoga', 'jadi', 'bahan', 'evaluasi', 'avoskin', 'untuk', 'bermitra', 'dengan', 'anteraja', 'karena', 'bisa', 'mempengaruhi', 'kepuasan', 'pelanggan', 'walaupun', 'produknya', 'tidak', 'ada', 'masalah', 'ecommerce', 'sebelah', 'kurir', 'bebas', 'ongkir', 'nya', 'enggak', 'selambat', 'ini']","['kali', 'belanja', 'official', 'store', 'avoskin', 'produknya', 'logistiknya', 'semoga', 'bahan', 'evaluasi', 'avoskin', 'bermitra', 'anteraja', 'mempengaruhi', 'kepuasan', 'pelanggan', 'produknya', 'ecommerce', 'sebelah', 'kurir', 'bebas', 'ongkir', 'nya', 'selambat']"
283,beli pcs serum yg dikirim cuma di resi ditulis pcs sori saya kasih bintang dulu sampai komplain saya ditangani,beli pcs serum yang dikirim cuma di resi ditulis pcs sori saya kasih bintang dulu sampai komplain saya ditangani,"['beli', 'pcs', 'serum', 'yang', 'dikirim', 'cuma', 'di', 'resi', 'ditulis', 'pcs', 'sori', 'saya', 'kasih', 'bintang', 'dulu', 'sampai', 'komplain', 'saya', 'ditangani']","['beli', 'pcs', 'serum', 'dikirim', 'resi', 'ditulis', 'pcs', 'sori', 'kasih', 'bintang', 'komplain', 'ditangani']"
284,baru nyoba udh pake seminggu sm skali gk ngurangin jerawat jerawat malah gk mati sm skali kering aja engga kempes engga malah merah gtu aja kya gk ngefek gtu sm skali pdhal cm jerawat krn after haid,baru mencoba sudah pakai seminggu sama sekali enggak ngurangin jerawat jerawat malah enggak mati sama sekali kering saja enggak kempes enggak malah merah begitu saja kaya enggak ngefek begitu sama sekali padahal cuma jerawat karena after haid,"['baru', 'mencoba', 'sudah', 'pakai', 'seminggu', 'sama', 'sekali', 'enggak', 'ngurangin', 'jerawat', 'jerawat', 'malah', 'enggak', 'mati', 'sama', 'sekali', 'kering', 'saja', 'enggak', 'kempes', 'enggak', 'malah', 'merah', 'begitu', 'saja', 'kaya', 'enggak', 'ngefek', 'begitu', 'sama', 'sekali', 'padahal', 'cuma', 'jerawat', 'karena', 'after', 'haid']","['mencoba', 'pakai', 'seminggu', 'ngurangin', 'jerawat', 'jerawat', 'mati', 'kering', 'kempes', 'merah', 'kaya', 'ngefek', 'jerawat', 'after', 'haid']"
285,ini sudah kelima kalinya saya repurchase baik dari avoskin official store maupun dari official store lain namun baru kali ini produk yang saya terima warnanya kekuningan bahkan ketika dijejerkan dengan produk lama yg sudah hampir habis jauh sekali kelihatan bedanya ketika saya tanyakan hanya dijawab sedang ditanyakan ke bagian qc dan tidak ada update sampai sistem auto close pembelian ini sangat disayangkan ya avoskin ini padahal produknya bagus tapi kok kali ini jelek sekali kualitas barang yg dikirim dan customer servicenya,ini sudah kelima kalinya saya repurchase baik dari avoskin official store maupun dari official store lain namun baru kali ini produk yang saya terima warnanya kekuningan bahkan ketika dijejerkan dengan produk lama yang sudah hampir habis jauh sekali kelihatan bedanya ketika saya tanyakan hanya dijawab sedang ditanyakan ke bagian qc dan tidak ada update sampai sistem auto close pembelian ini sangat disayangkan ya avoskin ini padahal produknya bagus tapi kok kali ini jelek sekali kualitas barang yang dikirim dan customer servicenya,"['ini', 'sudah', 'kelima', 'kalinya', 'saya', 'repurchase', 'baik', 'dari', 'avoskin', 'official', 'store', 'maupun', 'dari', 'official', 'store', 'lain', 'namun', 'baru', 'kali', 'ini', 'produk', 'yang', 'saya', 'terima', 'warnanya', 'kekuningan', 'bahkan', 'ketika', 'dijejerkan', 'dengan', 'produk', 'lama', 'yang', 'sudah', 'hampir', 'habis', 'jauh', 'sekali', 'kelihatan', 'bedanya', 'ketika', 'saya', 'tanyakan', 'hanya', 'dijawab', 'sedang', 'ditanyakan', 'ke', 'bagian', 'qc', 'dan', 'tidak', 'ada', 'update', 'sampai', 'sistem', 'auto', 'close', 'pembelian', 'ini', 'sangat', 'disayangkan', 'ya', 'avoskin', 'ini', 'padahal', 'produknya', 'bagus', 'tapi', 'kok', 'kali', 'ini', 'jelek', 'sekali', 'kualitas', 'barang', 'yang', 'dikirim', 'dan', 'customer', 'servicenya']","['kalinya', 'repurchase', 'avoskin', 'official', 'store', 'official', 'store', 'kali', 'produk', 'terima', 'warnanya', 'kekuningan', 'dijejerkan', 'produk', 'habis', 'bedanya', 'qc', 'update', 'sistem', 'auto', 'close', 'pembelian', 'disayangkan', 'ya', 'avoskin', 'produknya', 'bagus', 'kali', 'jelek', 'kualitas', 'barang', 'dikirim', 'customer', 'servicenya']"
286,barang seperti sudah dibuka oleh kurir,barang seperti sudah dibuka oleh kurir,"['barang', 'seperti', 'sudah', 'dibuka', 'oleh', 'kurir']","['barang', 'dibuka', 'kurir']"
287,eww tidak dapat free tonner refining tonner yg ml padahal alasan beli gara gara itu baru kali ini kecewa sama avoskin kek ngk niat banget ngasih hadiah eww beda sama brand sebelah,eww tidak dapat free tonner refining tonner yang ml padahal alasan beli gara gara itu baru kali ini kecewa sama avoskin kayak enggak niat banget mengasih hadiah eww beda sama brand sebelah,"['eww', 'tidak', 'dapat', 'free', 'tonner', 'refining', 'tonner', 'yang', 'ml', 'padahal', 'alasan', 'beli', 'gara', 'gara', 'itu', 'baru', 'kali', 'ini', 'kecewa', 'sama', 'avoskin', 'kayak', 'enggak', 'niat', 'banget', 'mengasih', 'hadiah', 'eww', 'beda', 'sama', 'brand', 'sebelah']","['eww', 'free', 'tonner', 'refining', 'tonner', 'ml', 'alasan', 'beli', 'gara', 'gara', 'kali', 'kecewa', 'avoskin', 'kayak', 'niat', 'banget', 'mengasih', 'hadiah', 'eww', 'beda', 'brand', 'sebelah']"
288,gapaham karyawannya yg kurang teliti atau gimana harusnya ada barang free tapi gak diberikan padahal jelas tertera ada free barang lain,gapaham karyawannya yang kurang teliti atau bagaimana harusnya ada barang free tapi enggak diberikan padahal jelas tertera ada free barang lain,"['gapaham', 'karyawannya', 'yang', 'kurang', 'teliti', 'atau', 'bagaimana', 'harusnya', 'ada', 'barang', 'free', 'tapi', 'enggak', 'diberikan', 'padahal', 'jelas', 'tertera', 'ada', 'free', 'barang', 'lain']","['gapaham', 'karyawannya', 'teliti', 'barang', 'free', 'tertera', 'free', 'barang']"
289,belinya harga normal tapi dapatnya stok lama exp padahal pemakaian refining serum kan ngga tiap hari dan hanya tipis mana harganya plg mahal diantara serum lainnya sebelumnya beli serum lain dpt yg exp rugi jatohnya,belinya harga normal tapi dapatnya stok lama exp padahal pemakaian refining serum kan enggak tiap hari dan hanya tipis mana harganya pulang mahal diantara serum lainnya sebelumnya beli serum lain dapat yang exp rugi jatohnya,"['belinya', 'harga', 'normal', 'tapi', 'dapatnya', 'stok', 'lama', 'exp', 'padahal', 'pemakaian', 'refining', 'serum', 'kan', 'enggak', 'tiap', 'hari', 'dan', 'hanya', 'tipis', 'mana', 'harganya', 'pulang', 'mahal', 'diantara', 'serum', 'lainnya', 'sebelumnya', 'beli', 'serum', 'lain', 'dapat', 'yang', 'exp', 'rugi', 'jatohnya']","['belinya', 'harga', 'normal', 'dapatnya', 'stok', 'exp', 'pemakaian', 'refining', 'serum', 'tipis', 'harganya', 'pulang', 'mahal', 'serum', 'beli', 'serum', 'exp', 'rugi', 'jatohnya']"
290,saya dikasi produk yg sudah kepake kemasan luarnya masih utuh tersegel tapi isi dalamnya sudah hampir habis tinggal sisa pake  habis kecewa berat jadinya saya order baru lagi skrg di toko lain insyaallah gak ketipu lagi,saya dikasih produk yang sudah terpakai kemasan luarnya masih utuh tersegel tapi isi dalamnya sudah hampir habis tinggal sisa pakai  habis kecewa berat jadinya saya order baru lagi sekarang di toko lain insyaallah enggak tertipu lagi,"['saya', 'dikasih', 'produk', 'yang', 'sudah', 'terpakai', 'kemasan', 'luarnya', 'masih', 'utuh', 'tersegel', 'tapi', 'isi', 'dalamnya', 'sudah', 'hampir', 'habis', 'tinggal', 'sisa', 'pakai', 'habis', 'kecewa', 'berat', 'jadinya', 'saya', 'order', 'baru', 'lagi', 'sekarang', 'di', 'toko', 'lain', 'insyaallah', 'enggak', 'tertipu', 'lagi']","['dikasih', 'produk', 'terpakai', 'kemasan', 'luarnya', 'utuh', 'tersegel', 'isi', 'dalamnya', 'habis', 'tinggal', 'sisa', 'pakai', 'habis', 'kecewa', 'berat', 'order', 'toko', 'insyaallah', 'tertipu']"
291,tidak ada isinya,tidak ada isinya,"['tidak', 'ada', 'isinya']",['isinya']
292,saya gatal kalau pake sama perih yaa setelah bbrp kali pemakaian,saya gatal kalau pakai sama perih ya setelah beberapa kali pemakaian,"['saya', 'gatal', 'kalau', 'pakai', 'sama', 'perih', 'ya', 'setelah', 'beberapa', 'kali', 'pemakaian']","['gatal', 'pakai', 'perih', 'ya', 'kali', 'pemakaian']"
293,isi nya tidak ada sheet mask hanya cairan,isi nya tidak ada sheet mask hanya cairan,"['isi', 'nya', 'tidak', 'ada', 'sheet', 'mask', 'hanya', 'cairan']","['isi', 'nya', 'sheet', 'mask', 'cairan']"
