,Review,Sentimen
0,kecewa banget saya pesan yang free pouch tapi dikirimnya cotton pad kaget pas unboxing untung di videokan segera kabarin customer servicenya dan disuruh isi googleform untuk dikirimkan ulang pouchnya setelah hari nggak ada kabar akhirnya saya tanya lagi dan hanya dikabari kalau stock pouch ternyata sudah habis padahal baik baik dan sabar ikutin prosedur dari customer service karena masih berpikiran positif ternyata begini caranya ya,Negatif
1,kali ini pengemasan tidak safe sepertinya tutup botol tidak kencang sehingga toner merembes keluar sampai dus basah saya memang tidak membuat video unboxing karna saya selalu mendapat produk dan packaging yg bagus dari avoskin saya kira dus basah karna hujan pas dibuka ternyata botol sudah kosong semoga mendapat tanggapan dari avoskin,Negatif
2,paket datangnya barang sudah pecah dan sy return ke seller sudah ikuti komplain proses dan lain sebagainya tapi malah akhirnya tiba seakan akan pesanan selesai sy terima barang dan uangnya dilepas ke seller sy kecewa sekali dan jd agak trauma untuk beli barang ksini chat seller untuk nanyain brg ud diterima tp dijawab formalitas saja baru kali ini sy belanja brg tidak diterima tp uang tidak kembali mungkin uangnya ga seberapa cuman krn responsnya yg mengecewakan mohon improvement untuk selanjutnya thx,Negatif
3,ga ada sabun nya ga sesuai deskripsi,Negatif
4,ga sesuai harapan,Negatif
5,bagus bgt buat kulit oily menghikangkan bruntusan dan mengecilkan pori,Positif
6,gak perlu diragukan lagi sih ini produk worth to buy pengiriman cepat packagingnya yg super aman thx seller,Positif
7,barang diterima dg baik dan expired la,Positif
8,bru nyoba,Netral
9,mudah mudahan cocok karena reviewnya bagus,Netral
10,mantap,Positif
11,bismillah smga cocok,Positif
12,kecewa banget pokoknya,Negatif
13,kecewaaaaa pengiriman lama wajah jadi breakout gatau harus gimana lagi ga ngerti,Negatif
14,ok smoga cocok,Positif
15,ok blom dcobain,Netral
16,udah langganan karna cocok pakai serum ini thanks seller,Positif
17,serumnya bener bener cair banget ini pemakaian selama hari tapi belum berasa bangt efeknya,Netral
18,mantab pake banget tp perjalanan pengiriman lam bgt,Netral
19,belum dicoba ngabisin dlu yg laen next bakal review klo ada hasilnya,Netral
20,cocok bngt buat oily skin kyk aku,Positif
21,baru sekali pake udh kerasa halus dimuka,Positif
22,barangnya gapernah sampe dari tanggal karna ilang kesalahan anteraja jadi gatau harus review apa,Netral
23,beli ini beserta skin care yg lain nya tapitidak pernah menerima sheet mask ini complaint lama banget dan ujung ujung nya tidak bisa ditindak lanjuti kecewa banget,Negatif
24,harusnya dpt free sesuai jam ordernya udah buru cekout biar ga habis pesenan  yg dtg cuma produk nya free nya ga dapat asli kecewa dan baru ngalamin yg ginian,Negatif
25,melembabkan banget teksturnya kental tp cepet banget nyerepnya,Netral
26,packaging nya jelek banget ini sih kyk nya ad oknum yg mau ngambil barangnya kardusnya di buka di bagian samping yg ga di segel tolong next nya packing lbh baik lagi,Negatif
27,tertipu tidak ada gratis hadiah sarung seperti di gambar,Negatif
28,dijanjikan expired th tapi dapetnyabulan,Negatif
29,pesen masker yang dikirim my bad ga di video unboxing nya tapi kecewa banget bisa lalai bgt team packing nya please kerja yg fokus dan bener biar customer ga dirugikan begini ga semua orang sempet bikin video unboxing begitu so sorry kasih bintang karna beneran kecewa buat customer yang lain kalo baca ini please be more careful ya kalo pesen disini sesibuk apapun sempetin video unboxing,Negatif
30,bahan ringan smg cocok,Positif
31,tipe kulitku berminyak,Netral
32,ringan bgt dibibir lup lup dh bwt azarine,Netral
33,no review found,Netral
34,kali ini paket white series yg dtng cmn harusnya udh komplain tpi ngga direspon samsek pantes didalam paket ada kertas cara ngajuin komplain trnyata emng ga beres isinya,Negatif
35,tidak sampai barang nya,Negatif
36,bikin bruntusan yg geleuh muka jadi keliatan dan kerasa kotor bgt ewh udh pake sunscreen dan toner yg soft light gitu no deh bener kata org ini buat kulit sensitif dan kering jangan pake akhirnya buat tangan dan area tubuh yg gelap aja deh,Negatif
37,serumnya ga dikirim,Negatif
38,baru pertama coba dan udah dipake beberapa hari sunscreennya bagus banget cocok buat acne face kuu ga lengket sama sekali,Positif
39,love banget makasih azarine tadinya beli karena dapet pc tapi ternyata emang bagus banget velvety lippie cream nyaa dan walau ga cocok warm tone ini bagus banget di akuu,Positif
40,pertama kali coba elum tau si,Netral
41,realpict sukses selalu seller,Positif
42,smuaa ok cuma ky nya kulitku yg ga cocok sm sunscreennya ngerasa lengket bgt makenya so sorry,Netral
43,baru pertama coba semoga cocok pengemasan cepat dan aman pengiriman cepat,Positif
44,saya pesen dua paket twin pack dan lg yg ini harusanya saya terima produk tp saya hanya terima saya tidak sempat melakukan video unboxing jd td bisa klaim mohon untuk setelahnya lbh berhati dan memperhatikan produk yg akan dikirim apa sudah sesuai dgn pesanan atau blm,Negatif
45,pelayanan admin nya jelek,Negatif
46,agak kesel ya aku udah nunggu barangnya dan yang dateng salah dong produknya mana di bungkusnya sesuai sama produk yang aku pesen alhasil aku buka tanpa di video tolong banget kalau semisal packing di cek dulu jangan salah kirim kaya gini selain rugi di harga aku juga jadi kehilangan kepercayaan sama ini toko mana lama juga mana ini fotonya ga bisa dilampirkan pula ada tulisan ada gangguan di rumah toped gatau deh serah di cek aja di data gudang seharusnya data pembelian dan produk yang ada di gudang jumlahnya beda,Negatif
47,barang yang dikirim cuman harusnya karena saya beli twin pack,Negatif
48,saya sudah pake harian di wajah saya jadi berminyak merah dan jadi beruntusan,Negatif
49,sesuai deskripsi,Positif
50,tipe kulitku berminyak masalah kulitku jerawat masalah kulitku pori besar,Netral
51,agak kecewa sm pengemasannya kardusnya peyok dalemnya gak ada bubble wrap biasanya ada bubble wrap nya untung paketnya aman,Negatif
52,tipe kulitku kering,Netral
53,cocok sama produknya,Positif
54,sudah berkali kali beli di toko official ini dan setiap kali pembelian selalu amanah thx,Positif
55,barang nya oke,Positif
56,repeat order,Netral
57,tiap belanja pasti salah klo ga kurang barangnya ya salah barangnya ikhlasin aja semoga berkah kalo produknya cocok pelayanan nya aja kurang atau butuh karyawan,Negatif
58,pelayanannya jelek bgt,Negatif
59,exp panjang thx,Negatif
60,dapet tekstur sudah keras dan menggumpal,Negatif
61,diterima dalam keaadan bocor seperti bekas lubang paku jd isinya tumpah jadi aku lem biar isinya gak tumpah baru pertama belanja disini malah kecewa padahal official store malas aja mau complain ntar lama lagi prosesnya,Negatif
62,teksturnya kental banget di aku kurang ngefek sih probably ga beli lagi,Negatif
63,botol semprotnya suka ngawur arahnya,Netral
64,produk baguss sering repurchase tapi suka kesel sama pumpnya isi masi banyak tapi gk kluar di pump susah kali pump nya,Netral
65,udah sering pake ini isinya banyak dan bahannya ga neko fkus melembabkan,Positif
66,tekstur ringan pengiriman cepat,Positif
67,respon toko nya cepet dan ramah belum dicoba mudah mudahan cocok,Positif
68,sdh langganan sll beli disini,Positif
69,tutup pumpnya gak bisa berfungsi tp ok gentle bgt washnya,Positif
70,fw enak sih dipake nya terus byk busa nya jd pake sedikit aja tuh udah bisa full semuka ampe ke leher cocok bgt buat kulitku yang sensitif,Positif
71,material bagus packaging aman ga bocor tekstur gel langsung meresap aman dari fragrance packaging pump juga hygenis semoga kulit sensitif saya cocok terimakasih ya,Positif
72,bagus pasti ro,Positif
73,baguus bagus cocok,Positif
74,dapet bonus,Positif
75,dikasi free gift jg keren,Positif
76,sebenernya aku suka banget produknya meresapnya cepat banget ke kulit ga lengket dan greasy nyaman daan kebetulan cocok karena bekas jerawatku emang jadi lebih memudar tidak hilang begitu saja dan tentunya butuh prosesnya ya bestie tapiii yang menurutku skin game harus perhatikan lagi adalah pemilihan packaging pump nya agak keras lalu produk yang keluar malah jadi loncat dan banyak terbuang entah di leher botol atau terjun bebas sedih hiks mungkin jika ada konsiderasi untuk improve pump nya aku akan kasih bintang ,Positif
77,maaf banget tp ini susah banget diratainnya dan whitecast parah bikin kulit jadi kering banget,Negatif
78,warna nya kuning entah karena apa,Netral
79,abis pake ini besokannya langsung muncul banyak jerawat kecil,Negatif
80,isinya berantakan,Negatif
81,bikin aku jerawatan,Negatif
82,produk belum dicoba pengiriman tidak menggunakan bubble wrap hanya produk dan kotak pengiriman saat dibuka botol terasa panas mungkin krn tidak di lapisi bubble wrap jadi langsung terpapar sinar matahari saat pengiriman semoga produk masi efektif kandungannya,Negatif
83,selangnya sependek apa sih sampe dia ilang kebawah wtf annoying bgt pakenya gmn coba udah aku cari tp gak ada selangnya pake tube ajalah kalo pake packaging kaya gini bermasalah mulu sayang bgt padahal formulanya sebagus itu tapi kalo packagingnya begini sihhh big no deh,Negatif
84,ini parah banget seller dan pengiriman kurir udah lama banget kirimnya plus waktu sampai dibuka paketnya rusak gajelas ini seller tidak professional dan tidak niat jualan sama sekali meskipun official store tolong hargai customer dengan dapat membungkus paket dengan baik dan benar,Negatif
85,untuk packaging suka bangettt dan pengeriman juga cepat cuman sorry bgt kykny memang ga cocok di aku kyk lgsg jerawatan besar gitu,Netral
86,warnanya kuning kiri padahal baru dibuka punya saya sudah pemakaian bulan kanan masih bening,Negatif
87,bener jadi geprek gak pake bubble wrap sama sekali hancur semua,Negatif
88,belum coba pertama kali beli semoga cocok bintang ini diberikan untuk respon admin dan pengantaran pesanan yg baik dan cepat,Positif
89,fast response on time delivery,Positif
90,blm coba semoga cocok,Positif
91,tipe kulitku berminyak masalah kulitku pori besar,Netral
92,semoga cocok  makasih bonusnya,Positif
93,barang tidak saya terima sampai sekarang kurir ditanya balesnya lama karna pengiriman dipindahtangankan sama kurir pertama kecewa saya pdhal alamat sudah sesuai dan  biasanya begini tolong kak dikomplain bagian ekspedisi pengirimannya trimakasih,Negatif
94,engga cocok mukaku tambah jerawat parah,Negatif
95,hadiahnya bohongan,Negatif
96,bohong,Negatif
97,baru mau coba semoga cocok tipe kulitku kombinasi masalah kulitku jerawat,Positif
98,okeee,Positif
99,tipe kulitku kering tipe kulitku normal,Netral
100,pertama kali nyobain dgn warna kulit saya yg cenderung agak gelap awalnya saya pikir bakal jomplang pas dipake tp ternyata blend bgt ma kulit warnanya jd agak lbh cerah tp bukan jd tone up jg teksturnya ky foundy cair cpt nyerap awalnya ky mate pas udah kering tp lama jd glow up,Positif
101,kynya udah botol ke apa gt secocok itu dikulit saya yg normal cenderung kering enaknya krn ga ada white cast ato tone up jd ga berasa cemong dikulit saya yg putih,Positif
102,botol kedua enak dikulit gampang menyerap ga ada masalah ke kulitnya mantap,Positif
103,produk tp beda isi cairannya cs ditanya ga membantu bertele tele,Negatif
104,kecewa karena isi tidak full seperti saya beli di tempat lain,Negatif
105,terpaksa kasi penilaian jelek untuk admin al el ve yang handle chat karena balasnya asal dan tidak menjawab konsultasi customer dengan baik pertanyan dan jawabannya tidak sesuai asal balas tanpa membaca permasalahan pembeli,Negatif
106,baru coba semoga cocok recommended seller,Positif
107,pertama kali nyoba tinted sunscreen mudahan cocok dan gak oksidasi sesuai klaimnya packing aman kardus ditambah bubble wrap tebel mantappp,Positif
108,pesan barang paket lengkap yg dtg hanya paket,Positif
109,lebih baik sabtu minggu tetap di proses walau kirim nya weekday padahal online gak tahu real or chat bot bikin insecure,Negatif
110,lemot responnya,Negatif
111,wtf pas buka tutupnya ternyata yg keputer malah ke tempat moisturizernya langsung tumpah setengah,Negatif
112,isi tidak sesuai,Negatif
113,thanks,Positif
114,well received thanks,Positif
115,barang sampai dengan aman cuma di aku agak ke abuan dikit tp masih bisa ditoleransi thx ya,Positif
116,produknya biasa saja tapi yg paling parah pelayanannya sangat tidak memuaskan tidak helpfull tidak customer oriented hati kalau belanja disini kesalahan sedikit saja bakal fatal,Negatif
117,katanya check out jam dapet lm taunya engga boohong banget buat yang mau check out jangan percaya ya,Negatif
118,kecewa pesanan saya dibatalkan yang lain tidak akan pernah mau beli lagi terimakasih alasan saya beli di toko ini adalah karna harga dari pusat normal sedangkan beli di reseller harga melambung jauh sampe rb kecewa udh ganti produk eye care lain makasih saya beli tetapi dibatalkan sama somethinc jahat bgt pesannya pake usaha juga kalau tidak beli eye game changer ini di sini mau beli dmn lagi di stockist harganya beda rb rb makasih belum lagi kadang pre order sungguh kecewa saya beli di official mana pun bs beli banyak makasih,Negatif
119,kecepatan pengiriman baik ada bubble warp,Netral
120,tipe kulitku sensitif masalah kulitku jerawat masalah kulitku pori besar,Netral
121,dpt harga ceban yay blm dicoba,Netral
122,pembelian kesekian kalinya cocok di muka apalagi klo pas jerawatan kulitnya tetep bs bnafas,Netral
123,ternyata dapet ya baru pertama kali semoga cocok,Netral
124,mudahan cocok terima kasih,Positif
125,udh sering beli ini dan selalu cocok,Netral
126,barang datang dengan selamat walau agak lama datangnya,Netral
127,packing nya bagus bgt utk cream dg hrg segitu tekstur ringan cepet meresap di kulit ga ada bau menyengat samsek semoga cocok di kulit aku yg kering tp bruntusan tq,Positif
128,terima kasih,Netral
129,bahannya ringan mudah menyerap cocok di kulit aku yg berjerawat gak bikin breakout the best pokoknya,Netral
130,tipe kulitku kombinasi masalah kulitku jerawat,Netral
131,tipe kulitku kombinasi,Netral
132,tipe kulitku berminyak masalah kulitku pori besar original terimakasih,Netral
133,bahannya ringan cocok digunakan,Positif
134,tipe kulitku berminyak baru mau nyoba makai ini tapi sebelumnya nyoba punya temen cocokkk,Netral
135,barang datang sesuai packing nya aman serta pengiriman cepat,Netral
136,berasa cerah jika sudah pakai cuman di aku jadi bkin kering jadi mesti pake pelembab muka lg,Netral
137,udah beberapa tahun pake emang cocok karena ga white cast gitu nyaman ringan juga thanks seller tipe kulitku kombinasi,Netral
138,warnanya cantik bangettt,Netral
139,cocok di tipe kulitku kombinasi,Netral
140,jujur agak panik pas liat dusnya penyok tapi ternyata isinya aman meskipun pas buka dus kemasan tutup botol moist nya agak kurang rapet untung isinya masih aman gak luber kemana mana,Netral
141,jujur agak panik pas liat dusnya penyok tapi ternyata isinya aman meskipun pas buka dus kemasan tutup botol moist nya agak kurang rapet untung isinya masih aman gak luber kemana mana baru sekali pake produk yang ini oke banget pas dipake ke kulit cocok suka sama packing barunya,Netral
142,cocok di kulit berminyak kemasannya lucu,Netral
143,bahannya ringan cepet meresap terus packaging nya ok banget,Netral
144,terima kasih banyak paket sudah sampai dengan selamat,Netral
145,barang bagus sesuai packing mantap terima kasih,Netral
146,gausah ditanya lagi emang sebagus itu lembab dan bisa bantu pulih skin barier sejauh ini moisturizer yg gak akan ganti lagi,Netral
147,produk sangat bangus langsung menyerap dan membuat lembab,Netral
148,udah repurchase berkali produk simple dan efektif packaging jg simple dan aman,Netral
149,cocok di kulit saya tekstur ringan dan sangat cepat menyerap di kulit super recommended,Positif
150,baeu nyoba pertama kali smoga bisa cocok krn reviewnya bagus,Netral
151,mantap sesuaiii semoga cocok,Netral
152,tadinya mau beli diofflinestore tp mahal bgt  pas cek dionline store nya cuma  karena dpt potongan sm lg flashsale langsung beli,Positif
153,makasiihh,Positif
154,makasih,Netral
155,makasiihh tp tumben ga ada gift nya,Netral
156,tipe kulitku berminyak masalah kulitku jerawat semoga cocok sama rangkaian ini terimakasih,Netral
157,stlh semingguan pke muka jd bruntusan gtw emng efek samping pemakaian ato emng ga cocok,Netral
158,bagus,Positif
159,pengirimannya cukup cepat dan barang yg dikirimkan sesuai pesanan expired datenya dan,Positif
160,cocok dikulit saya ngak kering atau ketarik pengiriman cepet mantull,Positif
161,lipstiknya mudah patah saran kalau pakai jangan diulur terlalu panjang,Positif
162,barang lengkap packing aman dan rapi belum coba productnya semoga cocok tipe kulitku normal,Positif
163,bacanya review nya bagus mudahan jg cocok terima kasih bonusnya pas banget pas lagi butuh,Positif
164,cocok dikulit sebelum pakai jerawat biji di pipi agak meradang malam dikasih besoknya udh mendingan dan kempes,Netral
165,sebenarnya bagus tapi di aq jatuhnya bikin bibir agak kering walaupun sebelum pake lipstick udh pakai lipbalm warnanya pigmented bgt merah queennya bagus bgt,Netral
166,exp date msh lama pengirimannya jg cepat dapet diskonnya lumayan lagi thanks somethinc,Positif
167,semoga cocok di kulitku yg sensitif ini karna banyak tmn yg rekomen coba ini jadi lgsg aku checkout,Positif
168,belum dicoba smg cocok,Netral
169,paket aman semoga cocok,Positif
170,masalah kulitku pori besar,Netral
171,tipe kulitku berminyak tipe kulitku kering tipe kulitku normal tipe kulitku kombinasi tipe kulitku sensitif masalah kulitku jerawat,Netral
172,kiriman cepat packing bagus,Positif
173,sesuai dengan deskripsi,Positif
174,ingredients nya bikin penasaran jd pengen cobain sejauh ini selalu repurchase produk avo dan selalu cocok aaaa,Positif
175,packing aman banget semoga cocok,Positif
176,alhamdulillah aku cocok pakai azarine kulit wajah ku perlahan teratasi dgn azarine thanks azarine,Positif
177,repurchased nda bikin kusam affordable,Netral
178,baguss semoga cocok,Positif
179,baru mau dicoba semoga cocok,Positif
180,produk ori dan aman kakak adminnya juga ramah banget bakal repurchase lagiii deh kayaknya,Positif
181,pengiriman dan pengemasan cepat bgt aman produk sesuai udh pernah coba dan lumayan bikin jerawat cpt mateng thankyou,Netral
182,top,Positif
183,tipe kulitku berminyak tipe kulitku kering tipe kulitku normal tipe kulitku kombinasi masalah kulitku kerutan masalah kulitku jerawat masalah kulitku pori besar tipe kulitku sensitif,Positif
184,exp,Positif
185,pertama banget dulu sih beli bagus bgt ya di muka waktu itu kemasan masih biru mungkin sktr tahun yang lalu masih belum viral perskincare an semenjak hamil ud stop pake produk bayi aja ini mau coba lagi karena kangen sensasinya waktu make dulu emang feelnya beda tp smga ngaruh di jerawat yg suka muncul tiba tiba,Netral
